user_id,title,genres,plot
142,"Shining, The (1980)",Horror,"국가: 미국
줄거리: 이 영화는 고립된 호텔에서 점차 광기에 빠져드는 한 남자의 이야기를 다룹니다.
분위기 및 심리변화: 음산하고 긴장감 넘치는 분위기 속에서, 주인공은 내적 혼란과 정신적 붕괴를 겪으며 가족을 위협하게 됩니다."
143,Oppenheimer (2023),Drama,"국가: 미국
줄거리: 원자폭탄 개발의 역사적 순간을 다룬 영화로, 과학자 오펜하이머의 삶과 도덕적 갈등을 그립니다.
분위기 및 심리변화: 진지하고 역사적인 분위기 속에서, 주인공은 책임감과 윤리적 갈등을 경험합니다."
144,Star Wars: The Last Jedi (2017),Action|Adventure|Fantasy|Sci-Fi,"국가: 미국
줄거리: 루크 스카이워커가 포스를 배우고 새로운 제다이를 양성하며 은하계의 위협에 맞서는 이야기를 그립니다.
분위기 및 심리변화: 영웅적이고 서사적인 분위기 속에서, 주인공은 희생과 용기를 배웁니다."
145,Doctor Strange (2016),Action|Adventure|Sci-Fi,"국가: 미국
줄거리: 사고로 인해 삶이 바뀐 외과 의사가 마법 세계에 입문하며 새로운 능력을 얻게 되는 이야기를 그립니다.
분위기 및 심리변화: 신비롭고 환상적인 분위기 속에서, 주인공은 자신의 한계를 뛰어넘고 희생을 배웁니다."
146,Pain & Gain (2013),Action|Comedy|Crime,"국가: 미국
줄거리: 피트니스 트레이너들이 부자가 되기 위해 범죄를 저지르는 과정을 다룬 실화 기반 영화입니다.
분위기 및 심리변화: 블랙 코미디적인 분위기 속에서, 주인공들은 탐욕과 도덕적 타락을 경험합니다."
147,Mission: Impossible - Dead Reckoning Part One (2023),Action|Adventure|Thriller,"국가: 미국
줄거리: 에단 헌트와 그의 팀이 세계적인 위협을 막기 위해 목숨을 건 임무를 수행합니다.
분위기 및 심리변화: 긴장감 넘치고 액션 가득한 분위기 속에서, 주인공은 용기와 희생을 다짐합니다."
148,Big Hero 6 (2014),Action|Animation|Comedy,"국가: 미국
줄거리: 천재 소년이 로봇 친구와 함께 도시를 구하기 위한 슈퍼히어로 팀을 결성하는 이야기를 그립니다.
분위기 및 심리변화: 따뜻하고 감동적인 분위기 속에서, 주인공은 팀워크와 희생의 가치를 배웁니다."
149,"Monsters, Inc. (2001)",Adventure|Animation|Children|Comedy|Fantasy,"국가: 미국
줄거리: 몬스터들이 아이들의 비명을 에너지로 사용하는 회사에서 벌어지는 유쾌한 이야기를 다룹니다.
분위기 및 심리변화: 유머러스하고 따뜻한 분위기 속에서, 주인공들은 우정과 책임의 가치를 배웁니다."
150,"Hunt, The (Jagten) (2012)",Drama,"국가: 덴마크
줄거리: 이 영화는 어린아이의 거짓말로 인해 한 남자가 사회적 고립과 억울함 속에서 고통받는 이야기를 다룹니다.
분위기 및 심리변화: 무거운 분위기 속에서, 주인공은 절망 속에서도 자신의 결백을 증명하려는 강인한 의지를 보입니다."
151,"Notebook, The (2004)",Drama|Romance,"국가: 미국
줄거리: 이 영화는 계층 차이를 넘어선 두 남녀의 사랑과 평생에 걸친 유대감을 그립니다.
분위기 및 심리변화: 감동적이고 낭만적인 분위기 속에서, 주인공들은 사랑을 통해 서로의 삶을 변화시키며 어려움을 극복합니다."
152,John Wick: Chapter 4 (2023),Action|Crime|Thriller,"국가: 미국
줄거리: 존 윅은 자신을 노리는 수많은 적들과 치열한 싸움을 벌이며 자신의 자유와 평화를 찾기 위해 고군분투합니다.
분위기 및 심리변화: 강렬하고 어두운 분위기 속에서, 주인공은 복수와 생존 사이에서 내면의 갈등을 겪습니다."
153,Guardians of the Galaxy Volume 3 (2023),Action|Adventure|Sci-Fi,"국가: 미국
줄거리: 은하를 지키기 위해 다양한 배경을 가진 영웅들이 함께하는 마지막 여정을 그립니다.
분위기 및 심리변화: 유머와 감동이 어우러진 분위기 속에서, 주인공들은 팀워크와 희생을 경험합니다."
154,JoJo's Bizarre Adventure: Diamond Is Unbreakable - Chapter 1 (2017),Action|Adventure,"국가: 일본
줄거리: 초능력을 가진 소년이 마을을 위협하는 적과 싸우며 친구들과 협력하는 이야기를 그립니다.
분위기 및 심리변화: 유머와 액션이 어우러진 분위기 속에서, 주인공은 용기와 우정의 가치를 배웁니다."
155,The King's Man (2020),Action|Adventure|Comedy,"국가: 영국
줄거리: 왕립 비밀 정보국이 결성되는 과정을 다루며, 제1차 세계대전을 배경으로 비밀 임무가 펼쳐집니다.
분위기 및 심리변화: 스릴 넘치고 역사적인 분위기 속에서, 주인공들은 용기와 희생정신을 발휘합니다."
156,Run (2020),Thriller,"국가: 미국
줄거리: 보호받고 자란 딸이 엄마의 비밀을 알아내고 진실을 파헤치며 벌어지는 서스펜스 스릴러입니다.
분위기 및 심리변화: 긴장감 넘치고 공포스러운 분위기 속에서, 주인공은 진실과 생존을 위한 결단을 다집니다."
157,Cars (2006),Animation|Children|Comedy,"국가: 미국
줄거리: 성공만을 꿈꾸던 자동차가 소도시에서 새로운 인연을 만나면서 우정과 삶의 가치를 배워가는 이야기입니다.
분위기 및 심리변화: 유쾌하고 따뜻한 분위기 속에서, 주인공은 우정과 겸손의 가치를 배웁니다."
158,"Rock, The (1996)",Action|Adventure|Thriller,"국가: 미국
줄거리: 이 영화는 금지된 생화학 무기를 이용한 테러를 막기 위해 고군분투하는 주인공들의 이야기를 다룹니다.
분위기 및 심리변화: 강렬하고 긴박한 분위기 속에서, 주인공들은 두려움을 극복하고 영웅적 결단으로 위기를 해결합니다."
159,The Endless (2017),Horror|Sci-Fi|Thriller,"국가: 미국
줄거리: 두 형제가 어린 시절 탈출했던 종교 집단으로 돌아가면서 겪는 초자연적 사건을 그립니다.
분위기 및 심리변화: 미스터리하고 불안한 분위기 속에서, 주인공들은 과거와의 갈등을 마주하며 진실을 탐구합니다."
160,Rampage (2018),Action|Adventure|Sci-Fi,"국가: 미국
줄거리: 유전자 변형으로 거대 괴수가 된 동물들이 도시를 위협하자, 이를 막기 위해 싸우는 주인공의 이야기를 그립니다.
분위기 및 심리변화: 액션과 스릴 넘치는 분위기 속에서, 주인공은 용기와 책임감을 발휘합니다."
161,Oppenheimer (2023),Drama,"국가: 미국
줄거리: 원자폭탄 개발의 역사적 순간을 다룬 영화로, 과학자 오펜하이머의 삶과 도덕적 갈등을 그립니다.
분위기 및 심리변화: 진지하고 역사적인 분위기 속에서, 주인공은 책임감과 윤리적 갈등을 경험합니다."
162,Guardians of the Galaxy Volume 3 (2023),Action|Adventure|Sci-Fi,"국가: 미국
줄거리: 은하를 지키기 위해 다양한 배경을 가진 영웅들이 함께하는 마지막 여정을 그립니다.
분위기 및 심리변화: 유머와 감동이 어우러진 분위기 속에서, 주인공들은 팀워크와 희생을 경험합니다."
163,The Hateful Eight (2015),Western,"국가: 미국
줄거리: 서로 다른 배경을 가진 여덟 명이 폭설에 갇혀 긴장감 넘치는 상황을 맞이하는 서부 스릴러입니다.
분위기 및 심리변화: 긴장감 넘치고 음산한 분위기 속에서, 주인공들은 신뢰와 배신 사이에서 갈등합니다."
164,Cocaine Bear (2023),Comedy|Crime|Thriller,"국가: 미국
줄거리: 코카인을 흡입한 곰이 마을을 휘젓고 다니는 코미디 스릴러입니다.
분위기 및 심리변화: 유머러스하고 스릴 넘치는 분위기 속에서, 주인공들은 생존을 위해 싸웁니다."
165,Saw II (2005),Horror|Thriller,"국가: 미국
줄거리: 살인마 직쏘의 두 번째 덫에 빠진 사람들이 목숨을 걸고 탈출하려는 과정을 그립니다.
분위기 및 심리변화: 공포스럽고 긴장감 넘치는 분위기 속에서, 주인공들은 생존과 두려움의 갈등을 경험합니다."
166,The Greatest Showman (2017),Drama,"국가: 미국
줄거리: 쇼 비즈니스의 시작을 이끈 한 남자의 열정과 도전 정신을 그린 뮤지컬 영화입니다.
분위기 및 심리변화: 활기차고 감동적인 분위기 속에서, 주인공은 꿈과 인내의 가치를 깨닫습니다."
167,Whiplash (2013),(no genres listed),"국가: 미국
줄거리: 젊은 드러머가 완벽을 추구하는 가혹한 스승과 함께 극한의 연습을 견디며 음악적 성취를 이룬다.
분위기 및 심리변화: 긴장감 넘치고 강렬한 분위기 속에서, 주인공은 열정과 자기 희생의 의미를 배웁니다."
168,Guardians of the Galaxy Volume 3 (2023),Action|Adventure|Sci-Fi,"국가: 미국
줄거리: 은하를 지키기 위해 다양한 배경을 가진 영웅들이 함께하는 마지막 여정을 그립니다.
분위기 및 심리변화: 유머와 감동이 어우러진 분위기 속에서, 주인공들은 팀워크와 희생을 경험합니다."
169,Dunkirk (2017),Action|Drama|Thriller|War,"국가: 영국
줄거리: 제2차 세계대전 중 덩케르크 철수 작전에서 생존을 위해 고군분투하는 군인들의 이야기를 그립니다.
분위기 및 심리변화: 긴박하고 서사적인 분위기 속에서, 주인공들은 생존과 희생의 가치를 경험합니다."
170,Night at the Museum (2006),Action|Comedy|Fantasy|IMAX,"국가: 미국
줄거리: 박물관 야간 경비원이 전시물들이 살아나는 신비로운 사건을 겪으며 벌어지는 코미디 모험 영화입니다.
분위기 및 심리변화: 유쾌하고 모험적인 분위기 속에서, 주인공은 호기심과 책임감을 배웁니다."
171,Spider-Man: Across the Spider-Verse (2023),Action|Adventure|Animation|Sci-Fi,"국가: 미국
줄거리: 마일스 모랄레스가 다양한 스파이더맨들과 함께 다중우주에서 위협에 맞서는 이야기입니다.
분위기 및 심리변화: 스릴 넘치고 감동적인 분위기 속에서, 주인공은 책임감과 협력의 중요성을 배웁니다."
172,John Wick (2014),Action|Thriller,"국가: 미국
줄거리: 전직 암살자 존 윅이 과거를 떠나려 하지만, 사랑하는 존재를 잃고 복수를 위해 다시 무대에 복귀하는 이야기입니다.
분위기 및 심리변화: 강렬하고 어두운 분위기 속에서, 주인공은 복수심과 생존 본능을 다짐합니다."
sunjae,Howl's Moving Castle (Hauru no ugoku shiro) (2004),Adventure|Animation|Fantasy|Romance,"국가: 일본
줄거리: 마법으로 인해 나이 든 모습이 된 소녀가 마법사 하울과 함께 모험을 떠나는 이야기를 그립니다.
분위기 및 심리변화: 환상적이고 감성적인 분위기 속에서, 주인공은 사랑과 용기를 배웁니다."
174,American Beauty (1999),Drama|Romance,"국가: 미국
줄거리: 중년 남성이 일상에서 벗어나 자유를 추구하며 자신의 삶을 되돌아보는 과정을 그립니다.
분위기 및 심리변화: 감성적이고 풍자적인 분위기 속에서, 주인공은 인생과 자아를 되찾으려 합니다."
175,"Fugitive, The (1993)",Thriller,"국가: 미국
줄거리: 이 영화는 살인 누명을 쓴 한 남자가 자신의 결백을 증명하기 위해 도망치며 진실을 밝히는 여정을 그린다.
분위기 및 심리변화: 긴박하고 스릴 넘치는 분위기 속에서, 주인공은 절망에서 희망으로 변화하며 끈기와 용기를 보여준다."
176,"Road Warrior, The (Mad Max 2) (1981)",Action|Adventure|Sci-Fi|Thriller,"국가: 호주
줄거리: 이 영화는 황폐해진 미래에서 희귀한 자원을 둘러싸고 벌어지는 생존과 희생의 이야기를 담고 있다.
분위기 및 심리변화: 거칠고 폭력적인 분위기 속에서, 주인공은 고독한 생존자에서 공동체를 위해 헌신하는 영웅으로 변화한다."
177,Carrie (1976),Drama|Fantasy|Horror|Thriller,"국가: 미국
줄거리: 초능력을 가진 소녀가 학교에서의 괴롭힘과 학대를 복수하는 공포 스릴러입니다.
분위기 및 심리변화: 공포스럽고 긴장감 넘치는 분위기 속에서, 주인공은 억눌린 감정과 복수심을 표출합니다."
178,Triangle of Sadness (2022),Comedy|Drama,"국가: 스웨덴
줄거리: 부유한 사람들이 탄 호화 크루즈에서 벌어지는 풍자적인 이야기를 통해 사회적 이슈를 다룹니다.
분위기 및 심리변화: 풍자적이고 불편한 분위기 속에서, 주인공들은 자아와 사회적 역할에 대한 갈등을 겪습니다."
179,Mission: Impossible - Fallout (2018),Action|Adventure|Thriller,"국가: 미국
줄거리: 에단 헌트와 팀이 세계를 위협하는 위험한 무기를 막기 위해 목숨을 건 임무를 수행합니다.
분위기 및 심리변화: 스릴과 액션이 가득한 분위기 속에서, 주인공은 책임감과 희생정신을 다집니다."
180,Dune (2021),Action|Adventure|Drama|Sci-Fi,"국가: 미국
줄거리: 사막 행성에서 자원을 둘러싸고 벌어지는 정치적 갈등과 주인공의 성장 이야기를 그립니다.
분위기 및 심리변화: 장엄하고 서사적인 분위기 속에서, 주인공은 용기와 운명에 맞서며 성장합니다."
181,Goodfellas (1990),Crime|Drama,"국가: 미국
줄거리: 한 남자가 갱스터 세계에 입문하고 점차 범죄의 세계에 빠져드는 과정을 그립니다.
분위기 및 심리변화: 현실적이고 어두운 분위기 속에서, 주인공은 욕망과 배신의 심리를 경험합니다."
182,Galaxy Quest (1999),Adventure|Comedy|Sci-Fi,"국가: 미국
줄거리: 과거 인기 TV 쇼의 배우들이 실제 우주 모험에 참여하게 되며 벌어지는 유쾌한 이야기를 그립니다.
분위기 및 심리변화: 유머러스하고 모험적인 분위기 속에서, 주인공들은 진정한 용기를 배우게 됩니다."
183,Deadpool 2 (2018),Action|Comedy|Sci-Fi,"국가: 미국
줄거리: 악당들을 물리치고자 하는 반영웅 데드풀이 더 강력한 적과 맞서 싸우는 이야기를 그립니다.
분위기 및 심리변화: 유머와 액션이 가득한 분위기 속에서, 주인공은 자기 희생과 팀워크의 가치를 배웁니다."
184,Legally Blonde (2001),Comedy|Romance,"국가: 미국
줄거리: 금발 소녀가 법대를 통해 편견을 깨고 자신의 능력을 증명하는 과정을 그린 코미디입니다.
분위기 및 심리변화: 유쾌하고 영감을 주는 분위기 속에서, 주인공은 자신감과 지혜를 배웁니다."
185,Lamb (2021),Drama|Mystery,"국가: 아이슬란드
줄거리: 양이 사람과 같은 형상을 한 아기를 낳으며 부부가 이상한 사건을 겪는 공포 영화입니다.
분위기 및 심리변화: 불안하고 기이한 분위기 속에서, 주인공은 가족과 고독의 의미를 되새깁니다."
186,The Founder (2016),Drama,"국가: 미국
줄거리: 맥도날드 프랜차이즈를 설립한 남자의 성공과 탐욕의 이야기를 다룹니다.
분위기 및 심리변화: 현실적이고 영감을 주는 분위기 속에서, 주인공은 욕망과 성공을 향한 집념을 드러냅니다."
187,Midnight Run (1988),Action|Comedy|Crime|Thriller,"국가: 미국
줄거리: 현상금 사냥꾼이 도망자를 잡아오며 벌어지는 유쾌한 도주극입니다.
분위기 및 심리변화: 유머러스하고 스릴 넘치는 분위기 속에서, 주인공은 신뢰와 우정의 가치를 배웁니다."
188,Finding Dory (2016),Adventure|Animation|Comedy,"국가: 미국
줄거리: 기억상실증이 있는 물고기 도리가 자신의 가족을 찾기 위한 여정을 그립니다.
분위기 및 심리변화: 따뜻하고 감동적인 분위기 속에서, 주인공은 가족과 우정의 소중함을 깨닫습니다."
189,Toy Story 3 (2010),Adventure|Animation|Children|Comedy|Fantasy|IMAX,"국가: 미국
줄거리: 장난감들이 주인과의 이별을 맞이하며 새로운 삶을 시작하는 이야기를 그립니다.
분위기 및 심리변화: 감동적이고 성숙한 분위기 속에서, 주인공들은 우정과 희생을 배웁니다."
190,Jack Reacher (2012),Action|Crime|Thriller,"국가: 미국
줄거리: 전직 군인 잭 리처가 의문의 살인 사건을 해결하며 진실을 밝혀내려는 과정을 그립니다.
분위기 및 심리변화: 스릴 넘치고 액션 가득한 분위기 속에서, 주인공은 정의와 복수를 다짐합니다."
191,Upgrade (2018),Action|Comedy|Horror|Sci-Fi|Thriller,"국가: 미국
줄거리: 테크놀로지로 인해 초능력을 얻은 남자가 범죄에 맞서 싸우는 이야기를 다룹니다.
분위기 및 심리변화: 어둡고 스릴 넘치는 분위기 속에서, 주인공은 복수와 인간성 사이에서 갈등합니다."
192,"Blind Side, The  (2009)",Drama,"국가: 미국
줄거리: 이 영화는 한 가정이 어려움에 처한 청소년을 돕고 그의 재능을 발견하며 성공으로 이끄는 과정을 그린다.
분위기 및 심리변화: 감동적이고 희망적인 분위기 속에서, 주인공은 불안과 소외감에서 자신감과 사랑으로 변화한다."
193,Barbarian (2022),Horror|Thriller,"국가: 미국
줄거리: 임시 거주지에서 이상한 현상을 경험하며 공포를 겪는 주인공의 이야기입니다.
분위기 및 심리변화: 긴장감 넘치고 공포스러운 분위기 속에서, 주인공은 두려움과 생존을 다짐합니다."
194,Aladdin (1992),Adventure|Animation|Children|Comedy|Musical,"국가: 미국
줄거리: 거리의 소년 알라딘이 마법의 램프를 통해 사랑과 모험을 찾는 이야기를 그립니다.
분위기 및 심리변화: 유쾌하고 판타지적인 분위기 속에서, 주인공은 사랑과 용기를 배웁니다."
195,Gunpowder Milkshake (2021),Action|Adventure|Thriller,"국가: 미국
줄거리: 여성이 킬러가 되어 어머니와 함께 조직에 맞서는 액션 영화입니다.
분위기 및 심리변화: 강렬하고 스타일리시한 분위기 속에서, 주인공은 복수와 가족의 가치를 배웁니다."
196,Moulin Rouge (2001),Drama|Musical|Romance,"국가: 미국
줄거리: 파리의 물랑 루즈에서 벌어지는 사랑과 비극의 이야기를 그린 뮤지컬 영화입니다.
분위기 및 심리변화: 화려하고 비극적인 분위기 속에서, 주인공들은 사랑과 희생을 경험합니다."
197,Parasite (2019),Comedy|Drama,"국가: 한국
줄거리: 한 가난한 가족이 부유한 집에 취업하면서 두 가족 간의 갈등과 비극이 벌어지는 이야기입니다.
분위기 및 심리변화: 어둡고 현실적인 분위기 속에서, 주인공들은 욕망과 계급 갈등을 경험합니다."
198,The Lighthouse (2019),Drama|Fantasy|Horror,"국가: 미국
줄거리: 외딴 섬에서 등대지기 두 사람이 고립 속에서 미쳐가는 과정을 그린 심리 스릴러입니다.
분위기 및 심리변화: 불안하고 긴장감 넘치는 분위기 속에서, 주인공들은 고립과 광기를 겪습니다."
199,"Green Mile, The (1999)",Crime|Drama,"국가: 미국
줄거리: 이 영화는 초자연적 능력을 가진 사형수와 교도소 경비원 사이의 특별한 유대를 중심으로 전개된다.
분위기 및 심리변화: 감동적이고 비극적인 분위기 속에서, 주인공은 인간애와 정의에 대한 깊은 깨달음을 얻는다."
200,Journey to the Center of the Earth (2008),Action|Adventure|Sci-Fi,"국가: 미국
줄거리: 탐험가들이 지구의 중심을 향해 모험을 떠나며 신비한 세계를 발견하는 이야기입니다.
분위기 및 심리변화: 흥미롭고 모험적인 분위기 속에서, 주인공들은 호기심과 용기를 발휘합니다."
201,Old Boy (2003),Mystery|Thriller,"국가: 한국
줄거리: 15년간 감금된 후 풀려난 남자가 복수를 위해 진실을 파헤치는 이야기입니다.
분위기 및 심리변화: 어두운 분위기 속에서, 주인공은 분노와 복수심에 사로잡힙니다."
202,Thor: Love and Thunder (2022),Action|Adventure|Fantasy,"국가: 미국
줄거리: 토르는 새로운 위협에 맞서 싸우며, 과거의 연인과 재회해 사랑과 영웅으로서의 역할을 다시 고민합니다.
분위기 및 심리변화: 유머러스하고 액션 가득한 분위기 속에서, 주인공은 용기와 사랑을 되찾습니다."
203,Twelve Angry Men (1954),Drama,"국가: 미국
줄거리: 살인 사건의 배심원들이 피고인의 유죄 여부를 두고 격렬한 토론을 벌이는 심리 드라마입니다.
분위기 및 심리변화: 긴장감 넘치는 분위기 속에서, 주인공들은 편견과 정의에 대해 고민합니다."
204,"Karate Kid, The (2010)",Action|Children|Drama,"국가: 미국, 중국
줄거리: 이 영화는 새로운 환경에 적응하려는 소년이 무술을 배우며 성장하는 이야기를 다룬다.
분위기 및 심리변화: 희망적이고 영감을 주는 분위기 속에서, 주인공은 두려움에서 자신감을 얻으며 용기를 배운다."
205,Mulholland Dr. (1999),Drama|Mystery|Romance,"국가: 미국
줄거리: 젊은 여성이 기억을 잃은 채 할리우드에서 겪는 미스터리와 환상의 이야기를 다룹니다.
분위기 및 심리변화: 불안하고 신비로운 분위기 속에서, 주인공은 자아와 현실의 경계를 탐구합니다."
206,Speed (1994),Action|Romance|Thriller,"국가: 미국
줄거리: 폭탄이 설치된 버스를 제 시간에 구출하기 위해 경찰이 고군분투하는 액션 스릴러입니다.
분위기 및 심리변화: 긴박하고 스릴 넘치는 분위기 속에서, 주인공은 책임감과 용기를 발휘합니다."
207,School of Rock (2003),Comedy|Musical,"국가: 미국
줄거리: 실패한 록 뮤지션이 교사로 위장해 학생들과 함께 밴드를 결성하며 꿈을 찾는 이야기를 그립니다.
분위기 및 심리변화: 유쾌하고 열정적인 분위기 속에서, 주인공과 학생들은 음악과 자기 발견의 기쁨을 느낍니다."
208,Casino (1995),Crime|Drama,"국가: 미국
줄거리: 라스베이거스의 카지노에서 권력과 배신을 둘러싼 갱스터들의 이야기를 그립니다.
분위기 및 심리변화: 어두운 분위기 속에서, 주인공들은 욕망과 배신의 갈등을 겪습니다."
209,Baby Driver (2017),Action|Crime|Thriller,"국가: 미국
줄거리: 음악에 맞춰 운전을 하는 천재 드라이버가 범죄 조직을 탈출하려는 이야기를 그립니다.
분위기 및 심리변화: 스릴 넘치고 스타일리시한 분위기 속에서, 주인공은 자유와 자기 결단을 다짐합니다."
210,Black Panther: Wakanda Forever (2022),Action|Adventure|Sci-Fi,"국가: 미국
줄거리: 와칸다의 왕국이 새로운 위협에 맞서 싸우며 영웅으로서의 사명을 다하는 과정을 그립니다.
분위기 및 심리변화: 감동적이고 영웅적인 분위기 속에서, 주인공들은 용기와 연대의 가치를 깨닫습니다."
211,Whiplash (2014),Drama,"국가: 미국
줄거리: 젊은 드러머가 완벽을 추구하는 가혹한 스승과 함께 극한의 연습을 견디며 음악적 성취를 이룬다.
분위기 및 심리변화: 긴장감 넘치고 강렬한 분위기 속에서, 주인공은 열정과 자기 희생의 의미를 배웁니다."
212,In the Mood For Love (Fa yeung nin wa) (2000),Drama|Romance,"국가: 홍콩
줄거리: 이 영화는 불륜으로 얽힌 두 남녀가 서로의 감정을 억누르며 가까워지는 이야기를 다룬다.
분위기 및 심리변화: 우아하고 감성적인 분위기 속에서, 주인공들은 사랑과 도덕적 갈등 속에서 복잡한 심리적 변화를 겪는다."
213,Air Force One (1997),Action|Thriller,"국가: 미국
줄거리: 테러리스트들이 대통령 전용기를 장악하자 대통령이 직접 그들과 싸우는 이야기를 그립니다.
분위기 및 심리변화: 긴장감 넘치고 액션 가득한 분위기 속에서, 주인공은 용기와 책임감을 발휘합니다."
214,The Martian (2015),Adventure|Drama|Sci-Fi,"국가: 미국
줄거리: 화성에 고립된 우주 비행사가 살아남기 위해 고군분투하며 구조를 기다리는 이야기를 그립니다.
분위기 및 심리변화: 고독하고 희망적인 분위기 속에서, 주인공은 생존 본능과 희망을 다짐합니다."
215,Air: Courting a Legend (2023),Drama,"국가: 미국
줄거리: 농구의 전설과 신발 브랜드가 협력하여 전설적인 신발을 만드는 과정을 그립니다.
분위기 및 심리변화: 감동적이고 영감을 주는 분위기 속에서, 주인공은 혁신과 협력의 가치를 배웁니다."
216,Transformers (2007),Action|Sci-Fi|Thriller|IMAX,"국가: 미국
줄거리: 인간과 외계 로봇들이 지구를 지키기 위해 협력하여 싸우는 이야기를 그립니다.
분위기 및 심리변화: 액션과 스릴 넘치는 분위기 속에서, 주인공들은 팀워크와 용기를 배웁니다."
217,Barbie (2023),Comedy,"국가: 미국
줄거리: 바비는 완벽한 세상에 살고 있다는 생각을 하다가, 현실 세계로 떨어지게 되며 진정으로 원하는 것이 무엇인지 깨닫기 시작합니다.
분위기 및 심리변화: 유머러스하고 경쾌한 분위기 속에서 주인공은 자아 찾기와 성장을 위한 여정을 그립니다."
