user_id,title,genres,plot
0,Talk to Me (2022),Horror,"국가: 미국
줄거리: 이 영화는 고립감과 소통의 부재가 어떻게 사람들의 정신적 상태에 영향을 미치는지에 대해 탐구하며, 헤드의 심리적 변화가 관객에게 전달됩니다.
분위기 및 심리변화: 다크하고 감정적인 분위기 속에서 주인공은 내면적 갈등과 변화를 겪습니다."
1,Do Not Disturb (2023),Comedy|Drama,"국가: 미국
줄거리: 영화는 고립된 공간에서 주인공이 점점 더 불안해하고, 외부의 영향과 내적 갈등이 심화되면서 긴장감이 증대됩니다.
분위기 및 심리변화: 고립과 불안의 심리적 변화를 중심으로 전개됩니다."
2,Indiana Jones and the Dial of Destiny (2023),Action|Adventure,"국가: 미국
줄거리: 인디아나 존스는 신비한 타임 머신을 둘러싼 모험을 그리며, 젊었을 때와는 다른 인물로 변화했음을 깨닫습니다.
분위기 및 심리변화: 액션과 모험이 중심이며, 주인공의 나이와 경험에 따른 내적 갈등과 변화가 중요한 테마입니다."
3,Schindler's List (1993),Drama|War,"국가: 미국
줄거리: 오스카 쉰들러는 나치 독일의 수많은 유대인들을 구출하는 인물로, 역사상 가장 유명한 구원자 중 하나입니다.
분위기 및 심리변화: 고통과 희생의 분위기 속에서 쉰들러의 도덕적 변화와 심리적 고뇌가 중심입니다."
4,Mad Max: Fury Road (2015),Action|Adventure|Sci-Fi|Thriller,"국가: 오스트레일리아
줄거리: 무법자들이 지배하는 포스트 아포칼립스 세계에서, 매드 맥스는 여성들과 함께 폭력적이고 혼란스러운 상황에 처합니다.
분위기 및 심리변화: 영화는 빠르게 변화하는 액션 속에서, 주인공의 심리적 갈등과 성장이 강조됩니다."
5,Barbie (2023),Comedy,"국가: 미국
줄거리: 바비는 완벽한 세상에 살고 있다는 생각을 하다가, 현실 세계로 떨어지게 되며 진정으로 원하는 것이 무엇인지 깨닫기 시작합니다.
분위기 및 심리변화: 유머러스하고 경쾌한 분위기 속에서 주인공은 자아 찾기와 성장을 위한 여정을 그립니다."
6,All Quiet on the Western Front (2022),Action|Drama|War,"국가: 독일
줄거리: 제1차 세계대전 중, 한 젊은 독일 병사는 전장에서의 고통과 죽음을 목격하면서 전쟁의 참혹함을 체험합니다.
분위기 및 심리변화: 어두운 분위기 속에서 주인공은 전쟁의 공포와 상실감, 그리고 감정적 무감각을 경험합니다."
7,(500) Days of Summer (2009),Comedy|Drama|Romance,"국가: 미국
줄거리: 이 영화는 사랑이 어떻게 시작되고 끝나는지를 비선형적인 방식으로 그립니다. 주인공은 사랑을 믿고, 여자는 그에 대한 생각이 달라 시간이 지나면서 관계는 변화합니다.
분위기 및 심리변화: 영화는 밝고 경쾌한 분위기에서 시작하지만, 주인공의 심리적 변화와 관계의 끝을 맞으며 감정의 진폭이 커집니다."
8,Schindler's List (1993),Drama|War,"국가: 미국
줄거리: 오스카 쉰들러는 나치 독일의 수많은 유대인들을 구출하는 인물로, 역사상 가장 유명한 구원자 중 하나입니다.
분위기 및 심리변화: 고통과 희생의 분위기 속에서 쉰들러의 도덕적 변화와 심리적 고뇌가 중심입니다."
9,Arrival (2016),Sci-Fi,"국가: 미국
줄거리: 외계인과의 소통을 시도하는 언어학자 루이스 뱅크스는 시간이 비선형적으로 흐르는 경험을 하며 언어와 시간의 관계를 탐구합니다.
분위기 및 심리변화: 영화는 감성적이고 철학적인 분위기 속에서, 주인공은 시간의 개념을 바꾸며 과거와 미래를 넘나드는 심리적 변화를 경험합니다."
10,Thor: Ragnarok (2017),Action|Adventure|Sci-Fi,"국가: 미국
줄거리: 토르는 자신의 고향 아스가르드를 구하기 위해 전설적인 전사와 싸우게 되며, 신의 권한을 잃고 본질을 재발견합니다.
분위기 및 심리변화: 유머러스한 분위기 속에서 토르는 내면적 갈등과 성장을 경험하며 자기 발견의 여정을 떠납니다."
11,Top Gun: Maverick (2022),Action|Drama,"국가: 미국
줄거리: 베테랑 조종사 매버릭은 새로운 세대의 젊은 조종사들을 훈련시키며, 자신의 과거와 항공전의 급변하는 세계에 맞서야 하는 이야기를 그립니다.
분위기 및 심리변화: 강렬한 액션과 향수를 자극하며, 주인공은 자신의 한계를 시험하고 용기를 되찾는 과정을 경험합니다."
12,Everything Everywhere All at Once (2022),Action|Comedy|Sci-Fi,"국가: 미국
줄거리: 평범한 중년 여성이 다중우주 속 다양한 자신과 연결되면서 자신의 인생을 되돌아보고 존재의 의미를 깨닫게 됩니다.
분위기 및 심리변화: 초현실적이고 혼란스러운 분위기 속에서, 주인공은 정체성과 가족애를 되찾기 위한 감정적이고 철학적인 변화를 겪습니다."
13,Beautiful Boy (2018),Drama,"국가: 미국
줄거리: 중독 문제로 고통받는 아들과 그를 구하려는 아버지의 힘겨운 여정을 그리며, 아버지는 희망과 절망을 오가며 끊임없이 갈등합니다.
분위기 및 심리변화: 현실적이고 애절한 분위기 속에서, 주인공은 가족의 사랑과 희생으로 성장하며, 중독의 어두운 면과 싸워 나갑니다."
14,"Book Thief, The (2013)",Children|Drama|War,"국가: 미국, 독일
줄거리: 이 영화는 전쟁 속에서 소녀가 책과 단어를 통해 세상의 참혹함과 희망을 동시에 발견하는 과정을 탐구합니다.
분위기 및 심리변화: 따뜻하면서도 비극적인 분위기 속에서, 주인공 리젤은 상실과 고통을 딛고 내적으로 성장하며 강인함을 갖추게 됩니다."
15,Pinocchio (2022),Adventure|Children|Fantasy,"국가: 이탈리아
줄거리: 진짜 소년이 되기를 꿈꾸는 나무 인형 피노키오는 다양한 시련을 통해 인간성의 의미를 깨닫게 됩니다.
분위기 및 심리변화: 환상적이고 어두운 분위기 속에서, 주인공은 자신의 정체성과 인간성을 찾기 위한 내적 성장을 경험합니다."
16,Nightmare Alley (2021),Crime|Drama|Mystery,"국가: 미국
줄거리: 타인의 심리를 조작하는 사기꾼은 권력과 성공에 대한 욕망 속에서 자신을 잃어갑니다. 성공을 향한 집착은 결국 파멸로 이끌며, 그는 자신의 내면의 어두운 면을 마주하게 됩니다.
분위기 및 심리변화: 긴장감 넘치고 어두운 분위기 속에서, 주인공은 욕망과 기만의 함정에 빠져 점점 더 파멸로 치닫는 심리적 변화를 겪습니다."
17,The Hunger Games: Mockingjay - Part 1 (2014),Adventure|Sci-Fi|Thriller,"국가: 미국
줄거리: 독재에 맞서 저항의 상징이 된 캣니스는 내면의 두려움과 책임감 사이에서 갈등하며 리더로 성장합니다. 자신이 상징하는 것에 대한 부담감과 전쟁의 압박 속에서도 희망과 자유를 위한 싸움을 계속합니다.
분위기 및 심리변화: 암울하고 혁명적인 분위기 속에서, 주인공은 두려움을 극복하고 저항의 상징으로 성장하는 과정에서 강인함을 다져갑니다."
18,(500) Days of Summer (2009),Comedy|Drama|Romance,"국가: 미국
줄거리: 이 영화는 사랑이 어떻게 시작되고 끝나는지를 비선형적인 방식으로 그립니다. 주인공은 사랑을 믿고, 여자는 그에 대한 생각이 달라 시간이 지나면서 관계는 변화합니다.
분위기 및 심리변화: 영화는 밝고 경쾌한 분위기에서 시작하지만, 주인공의 심리적 변화와 관계의 끝을 맞으며 감정의 진폭이 커집니다."
19,"Conjuring, The (2013)",Horror|Thriller,"국가: 미국
줄거리: 이 영화는 초자연적인 현상과 싸우는 워렌 부부의 실화를 바탕으로 한 공포 이야기를 다룹니다.
분위기 및 심리변화: 긴장감 넘치고 음산한 분위기 속에서, 주인공들은 공포를 극복하고 사명감과 용기를 얻게 됩니다."
20,Love at First Sight (2023),Drama|Romance,"국가: 미국
줄거리: 비행기에서 우연히 만난 두 사람이 서로에게 끌리며 예기치 않은 사랑을 시작합니다. 각자의 삶 속에서 상처받았던 이들은 서로를 통해 희망과 사랑을 다시 믿게 됩니다.
분위기 및 심리변화: 따뜻하고 낭만적인 분위기 속에서, 주인공들은 새로운 사랑을 통해 내면의 상처를 치유하며 감정적으로 성장합니다."
21,Up (2009),Adventure|Animation|Children|Drama,"국가: 미국
줄거리: 상실감을 겪은 할아버지 칼이 집을 풍선으로 띄워 과거의 꿈을 실현하려는 여정을 떠납니다. 어린 소년 러셀과의 우정을 통해 상처를 치유하고 삶의 의미를 다시 찾습니다.
분위기 및 심리변화: 따뜻하고 감동적인 분위기 속에서, 주인공은 상실에서 벗어나 희망을 되찾는 심리적 변화를 경험합니다."
22,Pitch Perfect (2012),Comedy|Musical,"국가: 미국
줄거리: 아카펠라 그룹에서 노래를 부르는 대학생들이 함께 성장하고 우정을 쌓아가며 대회를 준비하는 과정을 그립니다.
분위기 및 심리변화: 경쾌하고 유머러스한 분위기 속에서, 주인공들은 자신감을 얻고 팀워크를 배워가며 성장합니다."
23,The Hunger Games: Mockingjay - Part 1 (2014),Adventure|Sci-Fi|Thriller,"국가: 미국
줄거리: 독재에 맞서 저항의 상징이 된 캣니스는 내면의 두려움과 책임감 사이에서 갈등하며 리더로 성장합니다. 자신이 상징하는 것에 대한 부담감과 전쟁의 압박 속에서도 희망과 자유를 위한 싸움을 계속합니다.
분위기 및 심리변화: 암울하고 혁명적인 분위기 속에서, 주인공은 두려움을 극복하고 저항의 상징으로 성장하는 과정에서 강인함을 다져갑니다."
24,District 9 (2009),Mystery|Sci-Fi|Thriller,"국가: 남아프리카 공화국
줄거리: 외계인들이 난민으로 지구에 오게 되며, 그들과 인간들 사이의 갈등과 차별이 심화됩니다. 주인공은 외계인과의 접촉으로 자신의 인류적 정체성에 혼란을 겪습니다.
분위기 및 심리변화: 어둡고 묵직한 분위기 속에서, 주인공은 인류와의 갈등을 넘어 자신을 이해하는 여정을 경험합니다."
25,The Menu (2022),Comedy|Horror,"국가: 미국
줄거리: 한 미식가가 비밀스러운 요리 모임에 참여하며 예상치 못한 사건에 휘말리게 됩니다. 고급 요리의 세계에서 주인공은 자신과 대면하게 됩니다.
분위기 및 심리변화: 미스터리하고 불안한 분위기 속에서, 주인공은 자신의 내면과 두려움에 직면합니다."
26,Swallow (2020),Drama|Horror|Thriller,"국가: 미국
줄거리: 외형적으로 완벽한 삶을 사는 여성이 점차 자기 파괴적 행동을 보이며 자아를 찾으려는 과정을 겪습니다.
분위기 및 심리변화: 어두운 분위기 속에서 주인공은 억눌린 감정과 자신의 정체성을 탐구하며 심리적 갈등을 경험합니다."
27,"Darjeeling Limited, The (2007)",Adventure|Comedy|Drama,"국가: 미국
줄거리: 이 영화는 형제 세 사람이 기차 여행을 통해 갈등을 해소하고 서로를 이해하며 유대를 회복하는 이야기를 그립니다.
분위기 및 심리변화: 독특하고 코믹한 분위기 속에서, 형제들은 가족의 의미와 삶의 목적에 대해 성찰하며 내적으로 성장합니다."
28,Encanto (2021),Adventure|Animation|Children|Fantasy,"국가: 미국
줄거리: 마법 능력을 가진 가족 중 유일하게 능력이 없는 소녀가 가족의 유산을 지키기 위해 자신의 가치를 발견하는 과정을 그립니다.
분위기 및 심리변화: 따뜻하고 환상적인 분위기 속에서, 주인공은 자아와 가족의 진정한 의미를 찾습니다."
29,Batman Begins (2005),Action|Crime|IMAX,"국가: 미국
줄거리: 부모의 죽음 이후 브루스 웨인은 고담시를 지키기 위해 배트맨이 되기로 결심하고, 자신의 공포와 싸우며 성장합니다.
분위기 및 심리변화: 어둡고 강렬한 분위기 속에서, 주인공은 두려움을 극복하고 정의를 추구하는 결단을 다집니다."
30,Jungle Cruise (2021),Adventure|Children|Comedy|Fantasy,"국가: 미국
줄거리: 아마존 탐험을 떠난 모험가들이 신비로운 고대 유물을 찾아 나서며 위험한 여정을 경험합니다.
분위기 및 심리변화: 모험적이고 유머러스한 분위기 속에서, 주인공은 용기와 믿음을 배우며 자신의 한계를 뛰어넘습니다."
31,John Wick: Chapter 4 (2023),Action|Crime|Thriller,"국가: 미국
줄거리: 존 윅은 자신을 노리는 수많은 적들과 치열한 싸움을 벌이며 자신의 자유와 평화를 찾기 위해 고군분투합니다.
분위기 및 심리변화: 강렬하고 어두운 분위기 속에서, 주인공은 복수와 생존 사이에서 내면의 갈등을 겪습니다."
32,"Crazy, Stupid, Love. (2011)",Comedy|Drama|Romance,"국가: 미국
줄거리: 사랑과 결혼 생활에서 위기를 맞은 남자가 새로운 친구를 만나면서 자신의 삶과 관계를 다시 바라보게 됩니다.
분위기 및 심리변화: 유머와 감동이 어우러진 분위기 속에서, 주인공은 자신의 가치를 재발견하며 성숙해집니다."
33,Judas and the Black Messiah (2021),Drama,"국가: 미국
줄거리: 흑표당의 지도자인 프레드 햄프턴을 배신한 인물의 이야기를 통해 인종 차별과 정치적 갈등을 탐구합니다.
분위기 및 심리변화: 긴장감 넘치는 분위기 속에서, 주인공은 내면의 죄책감과 충돌을 겪습니다."
34,Coco (2017),Adventure|Animation|Children,"국가: 미국
줄거리: 죽은 자의 세상에서 가족의 비밀을 발견한 소년이 가족의 소중함을 깨닫고 꿈을 찾아가는 여정을 그립니다.
분위기 및 심리변화: 밝고 감동적인 분위기 속에서, 주인공은 가족과 꿈의 중요성을 되새기며 성장합니다."
35,Lady Bird (2017),Comedy,"국가: 미국
줄거리: 자신만의 정체성을 찾으려는 한 소녀가 가족과의 갈등 속에서 성장해가는 과정을 그립니다.
분위기 및 심리변화: 감성적이고 현실적인 분위기 속에서, 주인공은 자아와 가족의 중요성을 이해하며 성숙해집니다."
36,Past Lives (2023),Drama|Romance,"국가: 미국
줄거리: 어린 시절 사랑했던 친구와 재회하며 서로의 삶에 대한 복잡한 감정을 나누는 두 사람의 이야기입니다.
분위기 및 심리변화: 감동적이고 잔잔한 분위기 속에서, 주인공은 과거와 현재의 감정을 되돌아보며 내적 성장을 경험합니다."
37,Harry Potter and the Goblet of Fire (2005),Adventure|Fantasy|Thriller|IMAX,"국가: 영국
줄거리: 해리는 위험한 마법 대회에 참가하게 되며, 점차 다가오는 어둠의 세력과 마주하게 됩니다.
분위기 및 심리변화: 긴장감 넘치고 모험적인 분위기 속에서, 주인공은 용기와 책임감을 배워갑니다."
38,Guardians of the Galaxy (2014),Action|Adventure|Sci-Fi,"국가: 미국
줄거리: 우주를 지키기 위해 모인 다양한 배경의 영웅들이 힘을 합쳐 강력한 적에 맞서는 이야기를 그립니다.
분위기 및 심리변화: 유머와 액션이 가득한 분위기 속에서, 주인공들은 팀워크와 신뢰를 배웁니다."
39,Saving Private Ryan (1998),Action|Drama|War,"국가: 미국
줄거리: 제2차 세계 대전 중 한 병사를 구출하기 위해 위험한 임무를 수행하는 병사들의 이야기를 그립니다.
분위기 및 심리변화: 현실적이고 전쟁의 참혹함을 강조하는 분위기 속에서, 주인공은 전쟁의 무게와 인간의 용기를 경험합니다."
40,Alita: Battle Angel (2019),Action|Romance|Sci-Fi|Thriller,"국가: 미국
줄거리: 기억을 잃은 사이보그 소녀가 자신의 과거와 힘을 되찾기 위해 싸우며 정의를 추구하는 과정을 그립니다.
분위기 및 심리변화: 강렬하고 판타지적인 분위기 속에서, 주인공은 자신의 정체성과 사명을 찾는 여정을 겪습니다."
41,Pi (1998),Drama|Sci-Fi|Thriller,"국가: 미국
줄거리: 수학 천재가 무작위 숫자 속에서 우주의 비밀을 찾으려 하며 점차 광기에 사로잡히는 과정을 그립니다.
분위기 및 심리변화: 불안하고 어두운 분위기 속에서, 주인공은 집착과 혼란의 심리적 변화를 겪습니다."
42,Avatar (2009),Action|Adventure|Sci-Fi|IMAX,"국가: 미국
줄거리: 판도라 행성에서 원주민들과 교감하며 환경을 지키려는 한 인간의 이야기를 그립니다.
분위기 및 심리변화: 환상적이고 서정적인 분위기 속에서, 주인공은 자신의 정체성과 가치를 재발견합니다."
43,Pinocchio (1940),Animation|Children|Fantasy|Musical,"국가: 미국
줄거리: 나무 인형 피노키오가 진정한 소년이 되기 위해 겪는 다양한 모험과 교훈을 그립니다.
분위기 및 심리변화: 교훈적이고 따뜻한 분위기 속에서, 주인공은 순수함과 인간성을 찾습니다."
44,Nightcrawler (2014),Crime|Drama|Thriller,"국가: 미국
줄거리: 범죄 사건을 촬영하는 프리랜서 기자가 자극적인 장면을 얻기 위해 도덕적 경계를 넘나드는 이야기를 그립니다.
분위기 및 심리변화: 긴장감 넘치고 어두운 분위기 속에서, 주인공은 탐욕과 윤리적 갈등을 경험합니다."
45,Sharper (2023),Crime|Drama|Thriller,"국가: 미국
줄거리: 사기꾼들이 서로를 속이며 벌어지는 심리적 게임을 그립니다.
분위기 및 심리변화: 긴장감 넘치고 교활한 분위기 속에서, 주인공들은 불신과 배신의 심리적 변화를 겪습니다."
46,L.A. Confidential (1997),Crime|Film-Noir|Mystery|Thriller,"국가: 미국
줄거리: 1950년대 로스앤젤레스에서 부패와 범죄를 파헤치는 경찰들의 이야기를 그립니다.
분위기 및 심리변화: 어두운 필름 누아르 분위기 속에서, 주인공들은 정의와 부패 사이에서 갈등합니다."
47,Guardians of the Galaxy Volume 3 (2023),Action|Adventure|Sci-Fi,"국가: 미국
줄거리: 은하를 지키기 위해 다양한 배경을 가진 영웅들이 함께하는 마지막 여정을 그립니다.
분위기 및 심리변화: 유머와 감동이 어우러진 분위기 속에서, 주인공들은 팀워크와 희생을 경험합니다."
48,White Noise (2022),Comedy|Drama,"국가: 미국
줄거리: 일상의 소음과 현대 사회의 불안을 다루며 주인공이 삶의 의미를 찾으려는 과정을 그립니다.
분위기 및 심리변화: 독특하고 철학적인 분위기 속에서, 주인공은 현대 사회의 불안과 내면의 공허함을 탐구합니다."
49,Shazam! (2019),Action|Adventure|Fantasy|Sci-Fi,"국가: 미국
줄거리: 한 소년이 마법의 힘으로 슈퍼히어로가 되어 악에 맞서 싸우는 과정을 그립니다.
분위기 및 심리변화: 유머러스하고 활기찬 분위기 속에서, 주인공은 책임감과 용기를 배웁니다."
50,Mr. & Mrs. Smith (2005),Action|Adventure|Comedy|Romance,"국가: 미국
줄거리: 서로의 정체를 모른 채 결혼한 두 비밀 요원이 서로의 타깃이 되면서 벌어지는 액션을 그립니다.
분위기 및 심리변화: 유머와 액션이 어우러진 분위기 속에서, 주인공들은 신뢰와 사랑을 다시 찾으려 합니다."
51,Talk to Me (2022),Horror,"국가: 미국
줄거리: 이 영화는 고립감과 소통의 부재가 어떻게 사람들의 정신적 상태에 영향을 미치는지에 대해 탐구하며, 헤드의 심리적 변화가 관객에게 전달됩니다.
분위기 및 심리변화: 다크하고 감정적인 분위기 속에서 주인공은 내면적 갈등과 변화를 겪습니다."
52,Moana (2016),Adventure|Animation|Children|Comedy|Fantasy,"국가: 미국
줄거리: 모아나가 신화적인 존재들과 함께 바다를 항해하며 자신과 부족의 정체성을 찾아가는 여정을 그립니다.
분위기 및 심리변화: 활기차고 모험적인 분위기 속에서, 주인공은 자신의 용기와 지도자로서의 자질을 발견합니다."
53,Batman & Robin (1997),Action|Adventure|Fantasy|Thriller,"국가: 미국
줄거리: 배트맨과 로빈이 협력해 고담시를 위협하는 빌런들에 맞서 싸우는 이야기를 그립니다.
분위기 및 심리변화: 액션과 어두운 분위기 속에서, 주인공들은 팀워크와 책임감을 다져갑니다."
54,Arrival (2016),Sci-Fi,"국가: 미국
줄거리: 외계인과의 소통을 시도하는 언어학자 루이스 뱅크스는 시간이 비선형적으로 흐르는 경험을 하며 언어와 시간의 관계를 탐구합니다.
분위기 및 심리변화: 영화는 감성적이고 철학적인 분위기 속에서, 주인공은 시간의 개념을 바꾸며 과거와 미래를 넘나드는 심리적 변화를 경험합니다."
55,All Quiet on the Western Front (2022),Action|Drama|War,"국가: 독일
줄거리: 제1차 세계대전 중, 한 젊은 독일 병사는 전장에서의 고통과 죽음을 목격하면서 전쟁의 참혹함을 체험합니다.
분위기 및 심리변화: 어두운 분위기 속에서 주인공은 전쟁의 공포와 상실감, 그리고 감정적 무감각을 경험합니다."
56,Finding Nemo (2003),Adventure|Animation|Children|Comedy,"국가: 미국
줄거리: 실종된 아들 니모를 찾기 위해 바다를 탐험하는 아버지의 이야기를 그립니다.
분위기 및 심리변화: 따뜻하고 감동적인 분위기 속에서, 주인공은 가족의 소중함을 깨닫습니다."
57,No Time to Die (2020),Action|Adventure|Mystery|Thriller,"국가: 영국
줄거리: 제임스 본드는 과거의 적과 맞서며 자신과 주변 사람들을 지키기 위해 위험한 임무를 수행합니다.
분위기 및 심리변화: 긴장감 넘치고 스릴 넘치는 분위기 속에서, 주인공은 충성심과 희생을 경험합니다."
58,BlackBerry (2023),Comedy|Drama,"국가: 캐나다
줄거리: 블랙베리의 성공과 몰락을 다루며, 기업의 혁신과 도전 속에서의 갈등과 심리 변화를 탐구합니다.
분위기 및 심리변화: 현실적이고 감정적으로 복잡한 분위기 속에서, 주인공들은 도전과 실패의 교훈을 배웁니다."
59,Before Sunset (2004),Drama|Romance,"국가: 미국
줄거리: 오랜만에 재회한 두 사람이 파리에서의 짧은 시간을 함께 보내며, 서로의 감정을 확인하는 이야기를 그립니다.
분위기 및 심리변화: 감성적이고 잔잔한 분위기 속에서, 주인공들은 사랑과 인연에 대해 깊은 통찰을 얻습니다."
60,How to Train Your Dragon (2010),Adventure|Animation|Children|Fantasy|IMAX,"국가: 미국
줄거리: 소년이 드래곤과의 우정을 통해 마을 사람들과의 갈등을 극복하고 진정한 용사가 되는 과정을 그립니다.
분위기 및 심리변화: 모험적이고 따뜻한 분위기 속에서, 주인공은 용기와 배려심을 배웁니다."
61,The Flash (2023),Action|Adventure|Sci-Fi,"국가: 미국
줄거리: 플래시는 과거를 바꾸기 위해 시간 여행을 시도하지만, 예상치 못한 결과로 새로운 위협을 맞이하게 됩니다.
분위기 및 심리변화: 스릴 넘치고 긴장감 있는 분위기 속에서, 주인공은 책임감과 희생의 의미를 배웁니다."
62,Before Sunrise (1995),Drama|Romance,"국가: 미국
줄거리: 한 남녀가 유럽 여행 중 우연히 만나 하루를 함께 보내며 사랑을 나누는 이야기를 그립니다.
분위기 및 심리변화: 감성적이고 잔잔한 분위기 속에서, 주인공들은 사랑과 인연의 가능성을 탐구합니다."
63,"Killing, The (1956)",Crime|Film-Noir,"국가: 미국
줄거리: 이 영화는 치밀한 은행 강도 계획이 엇나가며 발생하는 비극적인 사건을 다룹니다.
분위기 및 심리변화: 어두운 누아르 분위기 속에서, 주인공은 계획 실패로 인한 좌절과 절망을 경험하며 인간의 약함을 드러냅니다."
64,Black Adam (2022),Action|Adventure|Fantasy,"국가: 미국
줄거리: 고대의 힘을 가진 블랙 아담이 현대에 부활하여 자신의 정의를 실현하고자 합니다.
분위기 및 심리변화: 강렬하고 파괴적인 분위기 속에서, 주인공은 힘의 사용에 대한 갈등을 경험합니다."
65,The Nice Guys (2016),Crime|Mystery|Thriller,"국가: 미국
줄거리: 1970년대 LA에서 두 탐정이 실종 사건을 해결하는 과정에서 벌어지는 유머와 액션을 그립니다.
분위기 및 심리변화: 유머러스하고 경쾌한 분위기 속에서, 주인공들은 우정과 팀워크를 배웁니다."
66,Star Wars: Episode I - The Phantom Menace (1999),Action|Adventure|Sci-Fi,"국가: 미국
줄거리: 은하계의 평화를 위협하는 시스의 음모 속에서 제다이들이 맞서 싸우는 이야기를 그립니다.
분위기 및 심리변화: 모험과 판타지적인 분위기 속에서, 주인공들은 용기와 신념을 배웁니다."
