user_id,title,genres,plot
294,Knock at the Cabin (2023),Horror|Mystery|Thriller,"국가: 미국
줄거리: 외딴 오두막에서 벌어지는 미스터리한 사건과 공포를 다루는 스릴러 영화입니다.
분위기 및 심리변화: 불안하고 긴장감 넘치는 분위기 속에서, 주인공들은 생존과 진실을 추구합니다."
295,"Goofy Movie, A (1995)",Animation|Children|Comedy|Romance,"국가: 미국
줄거리: 이 영화는 아버지와 아들이 함께하는 여행을 통해 가족 간의 유대와 이해를 그린다.
분위기 및 심리변화: 밝고 유쾌한 분위기 속에서, 주인공들은 갈등을 해소하고 서로를 이해하며 관계를 발전시킨다."
296,They Cloned Tyrone (2023),Comedy|Mystery|Sci-Fi,"국가: 미국
줄거리: 이상한 사건들을 조사하며 음모를 발견하는 세 명의 주인공들이 겪는 미스터리 스릴러입니다.
분위기 및 심리변화: 긴장감 넘치고 독특한 분위기 속에서, 주인공들은 진실을 밝히기 위해 고군분투합니다."
297,The Two Popes (2019),Drama,"국가: 미국
줄거리: 두 교황이 서로의 의견을 교환하며 우정을 쌓고 변화를 논의하는 이야기를 그립니다.
분위기 및 심리변화: 감동적이고 철학적인 분위기 속에서, 주인공들은 신념과 변화의 가치를 배웁니다."
298,"Silence of the Lambs, The (1991)",Crime|Horror|Thriller,"국가: 미국
줄거리: 이 영화는 연쇄살인범을 추적하는 FBI 요원과 정신과 의사 출신의 수감자 간의 심리전을 다룬다.
분위기 및 심리변화: 음산하고 섬뜩한 분위기 속에서, 주인공은 두려움과 약점을 극복하며 강인함을 갖춘다."
299,The Martian (2015),Adventure|Drama|Sci-Fi,"국가: 미국
줄거리: 화성에 고립된 우주 비행사가 살아남기 위해 고군분투하며 구조를 기다리는 이야기를 그립니다.
분위기 및 심리변화: 고독하고 희망적인 분위기 속에서, 주인공은 생존 본능과 희망을 다짐합니다."
300,Juno (2007),Comedy|Drama|Romance,"국가: 미국
줄거리: 10대 소녀가 임신을 경험하며 자신의 삶과 가족, 친구들과의 관계를 돌아보는 이야기를 그립니다.
분위기 및 심리변화: 유머와 따뜻함이 어우러진 분위기 속에서, 주인공은 성숙과 책임을 배우게 됩니다."
301,Guardians of the Galaxy Volume 3 (2023),Action|Adventure|Sci-Fi,"국가: 미국
줄거리: 은하를 지키기 위해 다양한 배경을 가진 영웅들이 함께하는 마지막 여정을 그립니다.
분위기 및 심리변화: 유머와 감동이 어우러진 분위기 속에서, 주인공들은 팀워크와 희생을 경험합니다."
302,Warcraft (2016),Action|Adventure|Fantasy,"국가: 미국
줄거리: 인간과 오크 간의 전쟁이 벌어지는 판타지 세계에서 두 종족의 갈등과 화합을 그립니다.
분위기 및 심리변화: 장엄하고 서사적인 분위기 속에서, 주인공들은 용기와 협력을 배웁니다."
303,Oppenheimer (2023),Drama,"국가: 미국
줄거리: 원자폭탄 개발의 역사적 순간을 다룬 영화로, 과학자 오펜하이머의 삶과 도덕적 갈등을 그립니다.
분위기 및 심리변화: 진지하고 역사적인 분위기 속에서, 주인공은 책임감과 윤리적 갈등을 경험합니다."
304,Wreck-It Ralph (2012),Animation|Comedy,"국가: 미국
줄거리: 게임 캐릭터가 자신의 악역 이미지를 벗어던지고 진정한 영웅이 되기 위해 모험을 떠나는 이야기입니다.
분위기 및 심리변화: 유쾌하고 감동적인 분위기 속에서, 주인공은 자아 발견과 용기를 배웁니다."
305,The Revenant (2015),Adventure|Drama,"국가: 미국
줄거리: 사냥꾼이 배신당한 후 복수를 다짐하며 생존을 위해 고군분투하는 이야기를 그립니다.
분위기 및 심리변화: 강렬하고 서사적인 분위기 속에서, 주인공은 생존 본능과 복수심을 다짐합니다."
306,Anchorman: The Legend of Ron Burgundy (2004),Comedy,"국가: 미국
줄거리: 1970년대 인기 뉴스 앵커가 여성의 등장으로 직장에서의 변화를 맞이하며 벌어지는 코미디 영화입니다.
분위기 및 심리변화: 유머러스하고 풍자적인 분위기 속에서, 주인공은 자아와 직업적 갈등을 경험합니다."
307,Star Wars: Episode IV - A New Hope (1977),Action|Adventure|Sci-Fi,"국가: 미국
줄거리: 젊은 루크 스카이워커가 은하계를 구하기 위해 제다이로서의 여정을 시작하는 이야기입니다.
분위기 및 심리변화: 영웅적이고 서사적인 분위기 속에서, 주인공은 용기와 희망을 발견합니다."
308,Get Out (2017),Horror,"국가: 미국
줄거리: 젊은 남성이 연인의 가족을 만나러 가면서 발생하는 기이한 사건을 그린 심리 스릴러입니다.
분위기 및 심리변화: 불안하고 미스터리한 분위기 속에서, 주인공은 공포와 진실에 직면합니다."
309,Jurassic World Dominion (2022),Action|Adventure|Sci-Fi|Thriller,"국가: 미국
줄거리: 공룡들이 인간 세상에 다시 나타나면서 벌어지는 이야기를 그린 액션 모험 영화입니다.
분위기 및 심리변화: 스릴 넘치고 장엄한 분위기 속에서, 주인공들은 생존과 자연의 경이로움을 경험합니다."
310,CODA (2021),Drama,"국가: 미국
줄거리: 청각장애인 부모와 함께 자란 소녀가 음악적 재능을 발견하며 새로운 인생을 찾는 이야기를 그립니다.
분위기 및 심리변화: 따뜻하고 감동적인 분위기 속에서, 주인공은 가족과 자아 사이에서 성장합니다."
311,Contact (1997),Drama|Sci-Fi,"국가: 미국
줄거리: 과학자가 외계 생명체와의 교신을 시도하며 인류와 과학의 의미를 탐구하는 이야기입니다.
분위기 및 심리변화: 신비롭고 철학적인 분위기 속에서, 주인공은 과학과 신념의 갈등을 겪습니다."
312,John Wick: Chapter 4 (2023),Action|Crime|Thriller,"국가: 미국
줄거리: 존 윅은 자신을 노리는 수많은 적들과 치열한 싸움을 벌이며 자신의 자유와 평화를 찾기 위해 고군분투합니다.
분위기 및 심리변화: 강렬하고 어두운 분위기 속에서, 주인공은 복수와 생존 사이에서 내면의 갈등을 겪습니다."
313,The Greatest Showman (2017),Drama,"국가: 미국
줄거리: 쇼 비즈니스의 시작을 이끈 한 남자의 열정과 도전 정신을 그린 뮤지컬 영화입니다.
분위기 및 심리변화: 활기차고 감동적인 분위기 속에서, 주인공은 꿈과 인내의 가치를 깨닫습니다."
314,Pirates of the Caribbean: The Curse of the Black Pearl (2003),Action|Adventure|Comedy|Fantasy,"국가: 미국
줄거리: 해적 잭 스패로우가 저주받은 보물을 되찾기 위해 모험을 떠나는 이야기를 그립니다.
분위기 및 심리변화: 모험적이고 유머러스한 분위기 속에서, 주인공은 용기와 자유의 가치를 배웁니다."
315,Code 8,Sci-Fi,"국가: 미국
줄거리: 초능력을 가진 사람들이 억압받는 사회에서 생존을 위해 싸우는 이야기를 다룹니다.
분위기 및 심리변화: 긴장감 넘치고 현실적인 분위기 속에서, 주인공은 정의와 저항을 다짐합니다."
316,Under the Skin (2013),Horror|Sci-Fi|Thriller,"국가: 영국
줄거리: 외계인이 인간의 모습을 하고 지구에서 인간을 유혹하며 벌어지는 이야기입니다.
분위기 및 심리변화: 불안하고 기이한 분위기 속에서, 주인공은 정체성과 인간성의 갈등을 겪습니다."
317,Dungeons & Dragons: Honor Among Thieves (2023),Action|Adventure|Fantasy,"국가: 미국
줄거리: 도둑과 모험가들이 함께 마법 세계에서 보물을 찾기 위한 여정을 떠납니다.
분위기 및 심리변화: 판타지와 모험이 어우러진 분위기 속에서, 주인공들은 팀워크와 우정을 배웁니다."
318,"Pursuit of Happyness, The (2006)",Drama,"국가: 미국
줄거리: 이 영화는 경제적 어려움을 딛고 아들과 함께 성공을 꿈꾸는 아버지의 실화를 바탕으로 한다.
분위기 및 심리변화: 희망적이고 감동적인 분위기 속에서, 주인공은 절망에서 희망과 성취로 나아간다."
319,Elemental (2023),Animation|Children|Comedy|Fantasy|Romance,"국가: 미국
줄거리: 서로 다른 성질을 가진 요소들이 공존하며 화합과 이해를 배우는 이야기를 그립니다.
분위기 및 심리변화: 따뜻하고 교훈적인 분위기 속에서, 주인공들은 차이를 극복하고 조화를 찾습니다."
320,American Psycho (2000),Crime|Horror|Mystery|Thriller,"국가: 미국
줄거리: 성공한 투자자가 이면의 폭력적이고 불안한 성향을 드러내며 벌어지는 심리 스릴러입니다.
분위기 및 심리변화: 불안하고 섬뜩한 분위기 속에서, 주인공은 정체성과 윤리적 갈등을 겪습니다."
321,The Super Mario Bros. Movie (2023),Adventure|Animation|Children|Comedy|Fantasy,"국가: 미국
줄거리: 마리오와 루이지가 모험을 통해 악당을 물리치고 왕국을 구하는 이야기를 그립니다.
분위기 및 심리변화: 유쾌하고 모험적인 분위기 속에서, 주인공들은 용기와 협동의 가치를 배웁니다."
322,Puss in Boots: The Last Wish (2022),Adventure|Animation|Children|Comedy|Fantasy,"국가: 미국
줄거리: 장화 신은 고양이가 마지막 남은 소원을 찾기 위해 새로운 모험을 떠나는 이야기입니다.
분위기 및 심리변화: 유쾌하고 모험적인 분위기 속에서, 주인공은 용기와 자아를 찾아갑니다."
323,Sherlock Holmes (2009),Action|Crime|Mystery|Thriller,"국가: 미국
줄거리: 명탐정 셜록 홈즈가 파트너 왓슨과 함께 미스터리를 해결하는 이야기를 다룹니다.
분위기 및 심리변화: 스릴 넘치고 지적인 분위기 속에서, 주인공은 추리와 용기를 발휘합니다."
324,2001: A Space Odyssey (1968),Adventure|Drama|Sci-Fi,"국가: 미국
줄거리: 우주 탐사를 배경으로 인류와 인공지능 간의 갈등을 다룬 철학적인 SF 영화입니다.
분위기 및 심리변화: 신비롭고 철학적인 분위기 속에서, 주인공은 존재와 기술의 의미를 탐구합니다."
325,Luther: The Fallen Sun (2023),Crime|Drama,"국가: 영국
줄거리: 형사 루터가 감옥에서 탈출한 후 복수를 위해 위험한 범죄자와 맞서는 이야기입니다.
분위기 및 심리변화: 어둡고 긴장감 넘치는 분위기 속에서, 주인공은 정의와 복수의 갈등을 겪습니다."
326,"Godfather, The (1972)",Crime|Drama,"국가: 미국
줄거리: 이 영화는 한 마피아 가문의 권력 다툼과 가족의 복잡한 관계를 중심으로 전개된다.
분위기 및 심리변화: 어둡고 서사적인 분위기 속에서, 주인공은 순수함에서 냉혹한 권력자로 변화한다."
327,Tropic Thunder (2008),Action|Adventure|Comedy|War,"국가: 미국
줄거리: 영화 촬영 도중 실제 전쟁 상황에 빠진 배우들이 겪는 코미디 영화입니다.
분위기 및 심리변화: 유머러스하고 풍자적인 분위기 속에서, 주인공들은 생존과 진정한 용기를 배웁니다."
328,The Unbearable Weight of Massive Talent (2021),Comedy,"국가: 미국
줄거리: 배우 니콜라스 케이지가 자신을 연기하며 팬과 얽히는 코미디 액션 영화입니다.
분위기 및 심리변화: 유쾌하고 독특한 분위기 속에서, 주인공은 자아와 성공의 의미를 찾습니다."
329,The French Dispatch (2020),Comedy|Drama|Romance,"국가: 미국
줄거리: 프랑스 마을에서 발행되는 잡지사의 기자들이 겪는 이야기를 다룬 옴니버스 영화입니다.
분위기 및 심리변화: 감각적이고 예술적인 분위기 속에서, 주인공들은 다양한 인간의 이야기를 탐구합니다."
330,"Thin Blue Line, The (1988)",Documentary,"국가: 미국
줄거리: 이 다큐멘터리는 살인 사건의 진실과 사법 체계의 오류를 파헤친다.
분위기 및 심리변화: 날카롭고 탐구적인 분위기 속에서, 관객은 정의와 시스템의 결함에 대한 의문을 갖게 된다."
331,The Lighthouse (2019),Drama|Fantasy|Horror,"국가: 미국
줄거리: 외딴 섬에서 등대지기 두 사람이 고립 속에서 미쳐가는 과정을 그린 심리 스릴러입니다.
분위기 및 심리변화: 불안하고 긴장감 넘치는 분위기 속에서, 주인공들은 고립과 광기를 겪습니다."
332,News of the World (2020),Drama|Western,"국가: 미국
줄거리: 전직 군인이 전쟁 고아 소녀를 가족에게 데려다주기 위해 긴 여정을 떠나는 이야기입니다.
분위기 및 심리변화: 감동적이고 서사적인 분위기 속에서, 주인공은 책임과 사랑을 배우게 됩니다."
333,"Karate Kid, The (2010)",Action|Children|Drama,"국가: 미국, 중국
줄거리: 이 영화는 새로운 환경에 적응하려는 소년이 무술을 통해 자신감을 얻고 성장하는 이야기를 다룬다.
분위기 및 심리변화: 희망적이고 영감을 주는 분위기 속에서, 주인공은 두려움을 극복하고 용기를 얻게 된다."
334,The Whale,Comedy|Drama,"국가: 미국
줄거리: 한 남자가 고립된 삶을 살아가며 과거의 실수를 회복하려는 과정을 그린 드라마입니다.
분위기 및 심리변화: 감정적이고 내면적인 분위기 속에서, 주인공은 고통과 용서를 경험합니다."
335,No Hard Feelings (2023),Comedy|Romance,"국가: 미국
줄거리: 젊은 여성이 고용된 임무로 인해 예기치 않은 우정을 쌓아가는 이야기를 그립니다.
분위기 및 심리변화: 유머러스하고 감동적인 분위기 속에서, 주인공은 성장을 경험합니다."
336,King Kong (2005),Action|Adventure|Drama|Fantasy|Thriller,"국가: 미국
줄거리: 거대한 원숭이 킹콩이 인간 세계와 충돌하며 벌어지는 모험과 로맨스를 그립니다.
분위기 및 심리변화: 장엄하고 감동적인 분위기 속에서, 주인공은 희생과 사랑을 배웁니다."
337,Barbie (2023),Comedy,"국가: 미국
줄거리: 바비는 완벽한 세상에 살고 있다는 생각을 하다가, 현실 세계로 떨어지게 되며 진정으로 원하는 것이 무엇인지 깨닫기 시작합니다.
분위기 및 심리변화: 유머러스하고 경쾌한 분위기 속에서 주인공은 자아 찾기와 성장을 위한 여정을 그립니다."
338,"Time Traveler's Wife, The (2009)",Drama|Romance|Sci-Fi,"국가: 미국
줄거리: 이 영화는 시간 여행이라는 독특한 설정 속에서 한 커플이 사랑과 관계의 어려움을 극복해 나가는 이야기를 다룬다.
분위기 및 심리변화: 감성적이고 신비로운 분위기 속에서, 주인공들은 시간의 제약 속에서도 사랑의 가치를 깨닫고 희생을 받아들인다."
339,Pain & Gain (2013),Action|Comedy|Crime,"국가: 미국
줄거리: 피트니스 트레이너들이 부자가 되기 위해 범죄를 저지르는 과정을 다룬 실화 기반 영화입니다.
분위기 및 심리변화: 블랙 코미디적인 분위기 속에서, 주인공들은 탐욕과 도덕적 타락을 경험합니다."
340,"Girl with the Dragon Tattoo, The (Män som hatar kvinnor) (2009)",Crime|Drama|Mystery|Thriller,"국가: 스웨덴, 덴마크, 노르웨이, 독일
줄거리: 이 영화는 실종 사건을 해결하려는 언론인과 해커가 팀을 이루어 진실을 밝혀내는 과정을 다룬다.
분위기 및 심리변화: 어둡고 긴장감 넘치는 분위기 속에서, 주인공들은 상처를 치유하며 신뢰와 용기를 배운다."
341,The Lobster (2015),Comedy|Romance|Sci-Fi,"국가: 아일랜드
줄거리: 싱글이 되면 짐승으로 변하는 사회에서 사랑을 찾기 위한 한 남자의 독특한 이야기를 그립니다.
분위기 및 심리변화: 기이하고 철학적인 분위기 속에서, 주인공은 사랑과 정체성의 갈등을 겪습니다."
342,The Suicide Squad (2021),Action|Adventure|Crime|Fantasy,"국가: 미국
줄거리: 범죄자들이 세상을 구하기 위해 고용되어 위험한 임무를 수행하는 이야기입니다.
분위기 및 심리변화: 유머와 액션이 어우러진 분위기 속에서, 주인공들은 팀워크와 용기를 배웁니다."
343,Ghostbusters (a.k.a. Ghost Busters) (1984),Action|Comedy|Sci-Fi,"국가: 미국
줄거리: 이 영화는 유령을 퇴치하는 팀이 뉴욕시를 구하기 위해 고군분투하는 이야기를 다룬다.
분위기 및 심리변화: 유쾌하고 코믹한 분위기 속에서, 주인공들은 팀워크와 기지를 통해 어려움을 극복한다."
344,Don't Worry Darling (2022),Drama|Horror|Mystery|Thriller,"국가: 미국
줄거리: 이상적인 마을에 사는 한 여성이 현실을 의심하게 되며 벌어지는 미스터리한 이야기입니다.
분위기 및 심리변화: 긴장감 넘치고 불안한 분위기 속에서, 주인공은 진실을 찾아 나섭니다."
345,Ticket to Paradise (2022),Comedy|Romance,"국가: 미국
줄거리: 두 부모가 딸의 결혼을 막기 위해 함께 여행을 떠나며 벌어지는 로맨틱 코미디입니다.
분위기 및 심리변화: 유쾌하고 따뜻한 분위기 속에서, 주인공들은 사랑과 화해의 의미를 되새깁니다."
346,Raymond & Ray (2022),Comedy|Drama,"국가: 미국
줄거리: 두 이복 형제가 아버지의 장례식을 통해 다시 만나며 과거의 상처를 치유하는 과정을 그립니다.
분위기 및 심리변화: 감정적이고 감동적인 분위기 속에서, 주인공들은 가족과 용서를 경험합니다."
347,Total Recall (1990),Action|Adventure|Sci-Fi|Thriller,"국가: 미국
줄거리: 미래 사회에서 자신의 정체성과 기억을 둘러싼 음모에 휘말리는 남자의 이야기를 다룹니다.
분위기 및 심리변화: 긴장감 넘치고 스릴 있는 분위기 속에서, 주인공은 진실과 자아를 찾습니다."
348,Puss in Boots: The Last Wish (2022),Adventure|Animation|Children|Comedy|Fantasy,"국가: 미국
줄거리: 장화 신은 고양이가 마지막 남은 소원을 찾기 위해 새로운 모험을 떠나는 이야기입니다.
분위기 및 심리변화: 유쾌하고 모험적인 분위기 속에서, 주인공은 용기와 자아를 찾아갑니다."
349,Coherence (2013),Drama|Mystery|Sci-Fi|Thriller,"국가: 미국
줄거리: 친구 모임 중 천문 현상이 발생하며 각자 다른 차원의 자신들과 만나게 되는 미스터리한 이야기입니다.
분위기 및 심리변화: 불안하고 기이한 분위기 속에서, 주인공들은 현실과 정체성에 혼란을 겪습니다."
350,Oppenheimer (2023),Drama,"국가: 미국
줄거리: 원자폭탄 개발의 역사적 순간을 다룬 영화로, 과학자 오펜하이머의 삶과 도덕적 갈등을 그립니다.
분위기 및 심리변화: 진지하고 역사적인 분위기 속에서, 주인공은 책임감과 윤리적 갈등을 경험합니다."
351,Chip 'n Dale: Rescue Rangers (2022),Adventure|Animation|Children|Comedy|Fantasy|Mystery,"국가: 미국
줄거리: 칩과 데일이 실사화된 세계에서 친구를 구하기 위해 모험을 떠나는 코미디 애니메이션입니다.
분위기 및 심리변화: 유쾌하고 모험적인 분위기 속에서, 주인공들은 우정과 용기를 발휘합니다."
352,Iron Man 2 (2010),Action|Adventure|Sci-Fi|Thriller|IMAX,"국가: 미국
줄거리: 토니 스타크는 아이언맨의 정체를 공개하고, 새로운 적과의 대결 속에서 기술과 책임감의 갈등을 겪습니다.
분위기 및 심리변화: 액션과 긴장감 있는 분위기 속에서, 주인공은 영웅으로서의 책임을 다시 고민합니다."
353,The Favourite,Drama,"국가: 영국
줄거리: 18세기 영국 왕실에서 여왕의 총애를 받기 위한 두 여성의 경쟁을 그립니다.
분위기 및 심리변화: 풍자적이고 감정적으로 복잡한 분위기 속에서, 주인공들은 권력과 욕망을 추구합니다."
354,Casino (1995),Crime|Drama,"국가: 미국
줄거리: 라스베이거스의 카지노에서 권력과 배신을 둘러싼 갱스터들의 이야기를 그립니다.
분위기 및 심리변화: 어두운 분위기 속에서, 주인공들은 욕망과 배신의 갈등을 겪습니다."
355,Cube (1997),Horror|Mystery|Sci-Fi|Thriller,"국가: 캐나다
줄거리: 몇 명의 사람들이 기하학적인 함정이 가득한 큐브 속에서 탈출을 시도하는 이야기입니다.
분위기 및 심리변화: 긴장감 넘치고 불안한 분위기 속에서, 주인공들은 공포와 생존의 갈등을 겪습니다."
356,Heat (1995),Action|Crime|Thriller,"국가: 미국
줄거리: 경찰과 범죄자가 서로를 추적하며 벌어지는 긴장감 넘치는 범죄 드라마입니다.
분위기 및 심리변화: 강렬하고 스릴 넘치는 분위기 속에서, 주인공들은 정의와 범죄의 경계를 넘나듭니다."
357,Casino (1995),Crime|Drama,"국가: 미국
줄거리: 라스베이거스의 카지노에서 권력과 배신을 둘러싼 갱스터들의 이야기를 그립니다.
분위기 및 심리변화: 어두운 분위기 속에서, 주인공들은 욕망과 배신의 갈등을 겪습니다."
358,"Passion of the Christ, The (2004)",Drama,"국가: 미국
줄거리: 이 영화는 예수 그리스도의 마지막 12시간을 충실히 재현한 이야기이다.
분위기 및 심리변화: 강렬하고 비극적인 분위기 속에서, 주인공은 육체적 고통을 통해 영적인 완성을 보여준다."
359,The Dig (2021),Drama,"국가: 영국
줄거리: 영국의 고고학적 발굴 현장에서 발생한 역사적 사건을 중심으로 한 드라마입니다.
분위기 및 심리변화: 감성적이고 차분한 분위기 속에서, 주인공들은 발견과 연결의 가치를 배웁니다."
360,"Hobbit: An Unexpected Journey, The (2012)",Adventure|Fantasy|IMAX,"국가: 미국, 뉴질랜드
줄거리: 이 영화는 호빗 빌보 배긴스가 모험에 나서며 자신의 용기와 재능을 발견하는 이야기를 다룬다.
분위기 및 심리변화: 신비롭고 서사적인 분위기 속에서, 주인공은 평범한 일상에서 벗어나 용기를 얻고 성장한다."
361,Arrival (2016),Sci-Fi,"국가: 미국
줄거리: 외계인과의 소통을 시도하는 언어학자 루이스 뱅크스는 시간이 비선형적으로 흐르는 경험을 하며 언어와 시간의 관계를 탐구합니다.
분위기 및 심리변화: 영화는 감성적이고 철학적인 분위기 속에서, 주인공은 시간의 개념을 바꾸며 과거와 미래를 넘나드는 심리적 변화를 경험합니다."
362,Men in Black: International (2019),Action|Adventure|Comedy|Sci-Fi,"국가: 미국
줄거리: 외계 생명체들을 감시하는 비밀 요원들이 새로운 위협에 맞서는 이야기를 다룹니다.
분위기 및 심리변화: 유쾌하고 액션이 넘치는 분위기 속에서, 주인공들은 팀워크와 용기를 발휘합니다."
363,Children of Men (2006),Action|Adventure|Drama|Sci-Fi|Thriller,"국가: 영국
줄거리: 인류가 불임 위기에 처한 미래에서 한 여성을 보호하며 인류의 희망을 찾아가는 이야기입니다.
분위기 및 심리변화: 절망적이고 서사적인 분위기 속에서, 주인공은 희망과 인간성을 되새깁니다."
364,The Pale Blue Eye (2022),Crime|Horror|Mystery|Thriller,"국가: 미국
줄거리: 웨스트포인트 사관학교에서 발생한 미스터리한 사건을 해결하기 위한 형사의 이야기를 그립니다.
분위기 및 심리변화: 어둡고 긴장감 넘치는 분위기 속에서, 주인공은 진실과 정의를 추구합니다."
365,Friday the 13th (1980),Horror|Mystery|Thriller,"국가: 미국
줄거리: 젊은이들이 여름 캠프에서 연쇄 살인마에 의해 희생되는 공포 영화입니다.
분위기 및 심리변화: 공포스럽고 긴장감 넘치는 분위기 속에서, 주인공들은 생존을 위해 싸웁니다."
366,Hacksaw Ridge (2016),Drama|War,"국가: 미국
줄거리: 전쟁 중에 무기를 들지 않고도 전우들을 구한 실화를 바탕으로 한 감동적인 전쟁 드라마입니다.
분위기 및 심리변화: 강렬하고 감동적인 분위기 속에서, 주인공은 용기와 신념을 보여줍니다."
367,"Big Lebowski, The (1998)",Comedy|Crime,"국가: 미국
줄거리: 이 영화는 우연히 음모에 휘말린 한 남자가 일상의 유머와 혼란 속에서 사건을 해결하는 과정을 그린다.
분위기 및 심리변화: 유머러스하고 독특한 분위기 속에서, 주인공은 현실에 대한 무심함과 유연함을 보여준다."
368,Sorry to Bother You (2018),Comedy|Fantasy|Sci-Fi,"국가: 미국
줄거리: 콜센터 직원이 성공을 위해 목소리를 바꾸면서 겪는 사회적 문제와 자아 갈등을 다룹니다.
분위기 및 심리변화: 풍자적이고 독특한 분위기 속에서, 주인공은 자본주의와 자신의 정체성 사이에서 갈등합니다."
369,Asteroid City (2023),Comedy|Drama|Romance|Sci-Fi,"국가: 미국
줄거리: 작은 마을에 떨어진 운석을 둘러싸고 벌어지는 사건들을 다룬 드라마입니다.
분위기 및 심리변화: 독특하고 신비로운 분위기 속에서, 주인공들은 호기심과 발견의 즐거움을 경험합니다."
