user_id,title,genres,plot
218,Mr. Mom (1983),Comedy|Drama,"국가: 미국
줄거리: 실직한 남편이 집에서 아이를 돌보며 겪는 코미디와 좌충우돌을 그립니다.
분위기 및 심리변화: 유쾌하고 가족적인 분위기 속에서, 주인공은 가족의 소중함과 역할 전환의 중요성을 배웁니다."
219,Braveheart (1995),Action|Drama|War,"국가: 미국
줄거리: 스코틀랜드의 전사 윌리엄 월리스가 자유를 위해 잉글랜드에 맞서 싸우는 이야기를 그립니다.
분위기 및 심리변화: 서사적이고 강렬한 분위기 속에서, 주인공은 희생과 용기의 의미를 배웁니다."
220,The Favourite,Drama,"국가: 영국
줄거리: 18세기 영국 왕실에서 여왕의 총애를 받기 위한 두 여성의 경쟁을 그립니다.
분위기 및 심리변화: 풍자적이고 감정적으로 복잡한 분위기 속에서, 주인공들은 권력과 욕망을 추구합니다."
221,Kiki's Delivery Service (Majo no takkyûbin) (1989),Adventure|Animation|Children|Drama|Fantasy,"국가: 일본
줄거리: 이 영화는 어린 마녀 키키가 독립해 살아가는 과정에서 성장과 자립의 의미를 배워가는 이야기를 그린다.
분위기 및 심리변화: 밝고 따뜻한 분위기 속에서, 주인공은 혼란과 두려움에서 자신감을 얻으며 성장한다."
222,The Equalizer 2 (2018),Action|Crime|Thriller,"국가: 미국
줄거리: 정의를 위해 악당을 처단하는 전직 요원이 친구의 죽음을 복수하는 이야기를 그립니다.
분위기 및 심리변화: 어둡고 긴장감 넘치는 분위기 속에서, 주인공은 정의와 복수심을 경험합니다."
223,Before Sunrise (1995),Drama|Romance,"국가: 미국
줄거리: 한 남녀가 유럽 여행 중 우연히 만나 하루를 함께 보내며 사랑을 나누는 이야기를 그립니다.
분위기 및 심리변화: 감성적이고 잔잔한 분위기 속에서, 주인공들은 사랑과 인연의 가능성을 탐구합니다."
224,Napoleon Dynamite (2004),Comedy,"국가: 미국
줄거리: 독특한 성격의 고등학생이 친구들과 함께 다양한 모험을 겪으며 성장하는 이야기를 다룹니다.
분위기 및 심리변화: 유머러스하고 독특한 분위기 속에서, 주인공은 우정과 자기 발견을 경험합니다."
225,Laputa: Castle in the Sky (Tenkû no shiro Rapyuta) (1986),Action|Adventure|Animation|Children|Fantasy|Sci-Fi,"국가: 일본
줄거리: 이 영화는 신비로운 공중 도시 라퓨타를 찾기 위해 여행을 떠난 두 소년과 소녀의 모험을 다룬다. 이야기는 자연과 기술, 평화와 전쟁의 대립을 중심으로 전개된다.
분위기 및 심리변화: 서정적이고 신비로운 분위기 속에서, 주인공들은 우정과 용기를 통해 어려움을 극복하며 성장과 깨달음을 얻는다."
226,Avatar: The Way of Water (2022),Action|Adventure|Sci-Fi,"국가: 미국
줄거리: 판도라의 바다와 새로운 문명 속에서 제이크와 네이티리가 가족을 지키기 위한 여정을 그립니다.
분위기 및 심리변화: 화려하고 감동적인 분위기 속에서, 주인공들은 가족과 생명의 소중함을 깨닫습니다."
227,Casino (1995),Crime|Drama,"국가: 미국
줄거리: 라스베이거스의 카지노에서 권력과 배신을 둘러싼 갱스터들의 이야기를 그립니다.
분위기 및 심리변화: 어두운 분위기 속에서, 주인공들은 욕망과 배신의 갈등을 겪습니다."
228,I'm Thinking of Ending Things,Drama|Horror|Thriller,"국가: 미국
줄거리: 여자친구가 남자친구의 부모를 만나러 가는 여정에서 불안과 혼란이 점차 커지는 심리 스릴러입니다.
분위기 및 심리변화: 불안하고 철학적인 분위기 속에서, 주인공은 자아와 관계에 대한 고뇌를 겪습니다."
229,Isle of Dogs (2018),Animation|Comedy,"국가: 미국
줄거리: 쓰레기 섬에 버려진 개들이 소년과 함께 모험을 떠나며 자유와 가족을 찾으려는 이야기를 그립니다.
분위기 및 심리변화: 감성적이고 유머러스한 분위기 속에서, 주인공은 우정과 충성을 경험합니다."
230,Scott Pilgrim vs. the World (2010),Action|Comedy|Fantasy|Musical|Romance,"국가: 미국
줄거리: 청년이 사랑을 쟁취하기 위해 여자친구의 전 남자친구들과 싸우는 독특한 연출의 액션 코미디입니다.
분위기 및 심리변화: 유머러스하고 과장된 분위기 속에서, 주인공은 사랑과 용기를 배웁니다."
231,Lady Bird (2017),Comedy,"국가: 미국
줄거리: 자신만의 정체성을 찾으려는 한 소녀가 가족과의 갈등 속에서 성장해가는 과정을 그립니다.
분위기 및 심리변화: 감성적이고 현실적인 분위기 속에서, 주인공은 자아와 가족의 중요성을 이해하며 성숙해집니다."
232,Murder Mystery 2 (2023),Action|Comedy|Mystery,"국가: 미국
줄거리: 부부 탐정이 국제적 사건에 연루되어 미스터리를 해결하려는 코미디 범죄 영화입니다.
분위기 및 심리변화: 유머와 긴장감이 어우러진 분위기 속에서, 주인공은 팀워크와 재치를 발휘합니다."
233,Missing (2023),Drama|Mystery|Thriller,"국가: 미국
줄거리: 실종된 가족을 찾기 위해 고군분투하는 이야기를 다루며 미스터리와 서스펜스를 자아냅니다.
분위기 및 심리변화: 긴장감 넘치는 분위기 속에서, 주인공은 끈기와 가족애를 발휘합니다."
234,Shazam! (2019),Action|Adventure|Fantasy|Sci-Fi,"국가: 미국
줄거리: 한 소년이 마법의 힘으로 슈퍼히어로가 되어 악에 맞서 싸우는 과정을 그립니다.
분위기 및 심리변화: 유머러스하고 활기찬 분위기 속에서, 주인공은 책임감과 용기를 배웁니다."
235,Possession (1981),Drama|Horror,"국가: 프랑스
줄거리: 부부의 불화와 심리적 갈등을 다루며 점차 공포로 변모하는 심리적 스릴러입니다.
분위기 및 심리변화: 불안하고 무서운 분위기 속에서, 주인공들은 관계와 정체성의 혼란을 겪습니다."
236,Glorious (2022),Horror,"국가: 미국
줄거리: 고속도로 휴게소에서 한 남자가 비정상적인 존재와 대면하며 벌어지는 공포와 미스터리를 다룹니다.
분위기 및 심리변화: 불안하고 기이한 분위기 속에서, 주인공은 공포와 혼란에 직면합니다."
237,The Shape of Water (2017),Adventure|Drama|Fantasy,"국가: 미국
줄거리: 청소부 여성이 비밀 연구소에서 만난 물 속 생명체와 사랑에 빠지며 벌어지는 이야기입니다.
분위기 및 심리변화: 환상적이고 감동적인 분위기 속에서, 주인공은 사랑과 연대의 가치를 배웁니다."
238,Paddleton (2019),Drama,"국가: 미국
줄거리: 말기 암을 진단받은 남성이 친구와 함께 남은 시간을 보내며 우정을 되새기는 이야기입니다.
분위기 및 심리변화: 따뜻하고 감성적인 분위기 속에서, 주인공들은 우정과 삶의 의미를 되새깁니다."
239,They Cloned Tyrone (2023),Comedy|Mystery|Sci-Fi,"국가: 미국
줄거리: 이상한 사건들을 조사하며 음모를 발견하는 세 명의 주인공들이 겪는 미스터리 스릴러입니다.
분위기 및 심리변화: 긴장감 넘치고 독특한 분위기 속에서, 주인공들은 진실을 밝히기 위해 고군분투합니다."
240,Super Size Me (2004),Comedy|Documentary|Drama,"국가: 미국
줄거리: 패스트푸드의 건강에 미치는 영향을 탐구하며 한 달간 패스트푸드만 먹는 실험을 진행합니다.
분위기 및 심리변화: 현실적이고 경각심을 일으키는 분위기 속에서, 주인공은 건강과 식습관에 대해 성찰합니다."
241,The Vast of Night (2019),Fantasy|Mystery|Sci-Fi,"국가: 미국
줄거리: 1950년대 뉴멕시코에서 두 라디오 진행자가 미스터리한 주파수를 발견하고 조사를 시작하는 이야기입니다.
분위기 및 심리변화: 긴장감 넘치고 신비로운 분위기 속에서, 주인공들은 진실을 추적하는 과정에서 호기심을 자극받습니다."
242,Rocketman (2019),Drama,"국가: 영국
줄거리: 전설적인 뮤지션 엘튼 존의 인생과 음악적 여정을 다룬 뮤지컬 영화입니다.
분위기 및 심리변화: 화려하고 감동적인 분위기 속에서, 주인공은 자기 발견과 성장을 경험합니다."
243,Kill Boksoon (2023),Action|Adventure|Thriller,"국가: 한국
줄거리: 숙련된 여성 암살자가 위험한 임무에 뛰어들며 벌어지는 액션 영화입니다.
분위기 및 심리변화: 긴박하고 액션 가득한 분위기 속에서, 주인공은 생존과 복수를 위해 싸웁니다."
244,Spectral (2016),(no genres listed),"국가: 미국
줄거리: 특수 작전 부대가 이상한 적과 싸우기 위해 초자연적 현상을 연구하는 이야기를 그립니다.
분위기 및 심리변화: 신비롭고 긴장감 넘치는 분위기 속에서, 주인공들은 생존과 진실을 밝히기 위해 고군분투합니다."
245,The Meg (2018),Action|Horror|Sci-Fi|Thriller,"국가: 미국
줄거리: 거대한 메갈로돈 상어가 해양 연구팀을 위협하며 벌어지는 스릴러 영화입니다.
분위기 및 심리변화: 긴장감 넘치고 스릴 넘치는 분위기 속에서, 주인공들은 공포와 생존을 위해 싸웁니다."
246,X2: X-Men United (2003),Action|Adventure|Sci-Fi|Thriller,"국가: 미국
줄거리: 뮤턴트들이 인간들과의 갈등 속에서 생존과 평화를 위해 싸우는 이야기입니다.
분위기 및 심리변화: 스릴 넘치는 액션 분위기 속에서, 주인공들은 팀워크와 용기의 가치를 배웁니다."
247,Firefly (2002),Action|Adventure|Sci-Fi|Western,"국가: 미국
줄거리: 우주를 배경으로 한 모험을 다룬 SF 시리즈로, 독립적인 우주선 승무원들이 다양한 위협에 맞서는 이야기를 그립니다.
분위기 및 심리변화: 모험적이고 긴장감 넘치는 분위기 속에서, 주인공들은 팀워크와 독립의 가치를 배웁니다."
248,Bubble (2022),Adventure|Animation|Sci-Fi,"국가: 일본
줄거리: 도쿄에 거대한 거품이 떨어지며 중력이 왜곡된 세계에서 청년들이 살아가는 이야기를 그립니다.
분위기 및 심리변화: 환상적이고 스릴 넘치는 분위기 속에서, 주인공들은 용기와 생존의 의미를 찾습니다."
249,Aftersun (2022),Drama,"국가: 영국
줄거리: 딸과의 추억을 되돌아보며 아버지와의 관계를 되새기는 감성적인 이야기입니다.
분위기 및 심리변화: 잔잔하고 감성적인 분위기 속에서, 주인공은 사랑과 가족의 의미를 되새깁니다."
250,Forrest Gump (1994),Comedy|Drama|Romance|War,"국가: 미국
줄거리: 순수한 청년이 우연히 역사적인 사건들을 경험하며 인생을 살아가는 이야기를 그립니다.
분위기 및 심리변화: 감동적이고 희망적인 분위기 속에서, 주인공은 인내와 사랑의 가치를 배웁니다."
251,Superbad (2007),Comedy,"국가: 미국
줄거리: 고등학생 친구들이 졸업 전날 밤에 벌이는 웃기고 엉뚱한 소동을 다룹니다.
분위기 및 심리변화: 유머러스하고 경쾌한 분위기 속에서, 주인공들은 우정과 성장의 의미를 깨닫습니다."
252,Paris Is Burning (1990),Documentary,"국가: 미국
줄거리: 1980년대 뉴욕의 LGBTQ+ 커뮤니티와 그들이 형성한 독특한 문화에 대한 다큐멘터리입니다.
분위기 및 심리변화: 감동적이고 현실적인 분위기 속에서, 주인공들은 정체성과 자존감을 탐구합니다."
253,Dead Poets Society (1989),Drama,"국가: 미국
줄거리: 문학을 통해 학생들에게 자기 표현과 자유를 가르치는 교사의 이야기를 다룹니다.
분위기 및 심리변화: 감동적이고 철학적인 분위기 속에서, 주인공들은 용기와 자기 발견의 의미를 배웁니다."
254,Gattaca (1997),Drama|Sci-Fi|Thriller,"국가: 미국
줄거리: 유전자 조작이 당연시되는 미래 사회에서 한 남자가 자신의 꿈을 위해 정체를 숨기는 이야기를 그립니다.
분위기 및 심리변화: 긴장감 넘치고 철학적인 분위기 속에서, 주인공은 희망과 인간의 한계를 탐구합니다."
255,The Imitation Game (2014),Drama|Thriller|War,"국가: 영국
줄거리: 천재 수학자 앨런 튜링이 2차 세계대전 중 암호를 해독하는 과정을 다룹니다.
분위기 및 심리변화: 긴장감 넘치고 감동적인 분위기 속에서, 주인공은 편견과 싸우며 내면의 강인함을 드러냅니다."
256,Punch-Drunk Love (2002),Comedy|Drama|Romance,"국가: 미국
줄거리: 감정적으로 불안정한 남자가 사랑을 통해 새로운 삶을 시작하는 과정을 그립니다.
분위기 및 심리변화: 불안하면서도 감성적인 분위기 속에서, 주인공은 사랑과 자기 발견의 여정을 겪습니다."
257,Jojo Rabbit (2019),Comedy|War,"국가: 미국
줄거리: 2차 세계대전 중 소년이 상상의 친구 히틀러와 함께 성장을 경험하며 진실을 발견하는 이야기입니다.
분위기 및 심리변화: 유머와 감동이 어우러진 분위기 속에서, 주인공은 용기와 관용의 가치를 배웁니다."
258,Doctor Strange in the Multiverse of Madness (2022),Action|Adventure|Fantasy,"국가: 미국
줄거리: 마법사 닥터 스트레인지가 다중 우주 속에서 다양한 위협에 맞서는 이야기를 다룹니다.
분위기 및 심리변화: 스릴 넘치고 신비로운 분위기 속에서, 주인공은 희생과 용기를 다시 다짐합니다."
259,Munich (2005),Action|Crime|Drama|Thriller,"국가: 미국
줄거리: 뮌헨 올림픽에서 벌어진 테러에 대한 보복 작전을 수행하는 요원들의 이야기를 그립니다.
분위기 및 심리변화: 긴장감 넘치고 현실적인 분위기 속에서, 주인공은 정의와 복수의 갈등을 경험합니다."
260,The Greatest Beer Run Ever (2022),Comedy|Drama|War,"국가: 미국
줄거리: 전쟁 중 친구들에게 맥주를 전달하기 위해 위험을 무릅쓰고 여행을 떠나는 이야기를 그립니다.
분위기 및 심리변화: 유머와 감동이 어우러진 분위기 속에서, 주인공은 우정과 용기의 가치를 배웁니다."
261,"Dark Knight, The (2008)",Action|Crime|Drama|IMAX,"국가: 일본
줄거리: 이 영화는 공중 도시 라퓨타를 둘러싼 모험과 우정의 이야기를 중심으로 전개된다.
분위기 및 심리변화: 신비롭고 감동적인 분위기 속에서, 주인공은 두려움에서 용기와 책임감을 얻으며 성장한다."
262,The Banshees of Inisherin (2022),Comedy|Drama,"국가: 아일랜드
줄거리: 아일랜드 시골 마을에서 벌어지는 두 친구의 갈등과 우정을 다룬 이야기입니다.
분위기 및 심리변화: 잔잔하고 서정적인 분위기 속에서, 주인공은 인간 관계의 깊이를 되새깁니다."
263,Moneyball (2011),Drama,"국가: 미국
줄거리: 야구팀 단장이 통계를 활용해 약팀을 강팀으로 변화시키는 과정을 그린 실화 기반 드라마입니다.
분위기 및 심리변화: 감동적이고 현실적인 분위기 속에서, 주인공은 혁신과 끈기의 가치를 깨닫습니다."
264,The Martian (2015),Adventure|Drama|Sci-Fi,"국가: 미국
줄거리: 화성에 고립된 우주 비행사가 살아남기 위해 고군분투하며 구조를 기다리는 이야기를 그립니다.
분위기 및 심리변화: 고독하고 희망적인 분위기 속에서, 주인공은 생존 본능과 희망을 다짐합니다."
265,The Lodge (2019),Drama|Horror,"국가: 미국
줄거리: 눈 덮인 외딴 오두막에서 가족이 겪는 기이하고 공포스러운 사건을 다루는 이야기입니다.
분위기 및 심리변화: 불안하고 공포스러운 분위기 속에서, 주인공들은 두려움과 고립을 겪습니다."
266,Vengeance (2022),Comedy|Drama|Thriller,"국가: 미국
줄거리: 한 남성이 친구의 죽음을 파헤치기 위해 텍사스로 여행을 떠나며 벌어지는 코미디 미스터리입니다.
분위기 및 심리변화: 유머러스하고 긴장감 넘치는 분위기 속에서, 주인공은 진실과 정의를 추구합니다."
267,Signs (2002),Horror|Sci-Fi|Thriller,"국가: 미국
줄거리: 외딴 농장에 사는 가족이 기이한 표식과 외계인의 존재를 발견하며 겪는 이야기입니다.
분위기 및 심리변화: 불안하고 미스터리한 분위기 속에서, 주인공은 두려움과 믿음을 다짐합니다."
268,Glass Onion: A Knives Out Mystery (2022),Comedy|Crime|Mystery,"국가: 미국
줄거리: 유명한 탐정이 섬에서 벌어진 미스터리한 살인 사건을 해결하려는 과정을 다룹니다.
분위기 및 심리변화: 유머와 긴장감이 어우러진 분위기 속에서, 주인공은 재치와 추리력을 발휘합니다."
269,"Bourne Ultimatum, The (2007)",Action|Crime|Thriller,"국가: 미국, 독일
줄거리: 이 영화는 기억을 잃은 첩보원 제이슨 본이 자신의 정체를 찾아가는 과정을 그린다.
분위기 및 심리변화: 긴장감 넘치는 분위기 속에서, 주인공은 혼란에서 진실을 발견하며 자신감을 회복한다."
270,"Untouchables, The (1987)",Action|Crime|Drama,"국가: 미국
줄거리: 이 영화는 알 카포네와의 싸움을 중심으로 정의와 부패를 그린 경찰들의 이야기를 다룬다.
분위기 및 심리변화: 강렬하고 영웅적인 분위기 속에서, 주인공은 의심과 두려움을 극복하고 정의를 실현한다."
271,Glass Onion: A Knives Out Mystery (2022),Comedy|Crime|Mystery,"국가: 미국
줄거리: 유명한 탐정이 섬에서 벌어진 미스터리한 살인 사건을 해결하려는 과정을 다룹니다.
분위기 및 심리변화: 유머와 긴장감이 어우러진 분위기 속에서, 주인공은 재치와 추리력을 발휘합니다."
272,Ferris Bueller's Day Off (1986),Comedy,"국가: 미국
줄거리: 고등학생이 학교를 빠지고 친구들과 즐거운 하루를 보내는 이야기입니다.
분위기 및 심리변화: 유쾌하고 자유로운 분위기 속에서, 주인공은 젊음과 자유의 가치를 만끽합니다."
273,Snatch (2000),Comedy|Crime|Thriller,"국가: 영국
줄거리: 여러 범죄자들이 한 다이아몬드를 둘러싸고 얽히며 벌어지는 사건을 다룹니다.
분위기 및 심리변화: 빠르고 블랙 코미디적인 분위기 속에서, 주인공들은 탐욕과 운명의 갈등을 겪습니다."
274,"Karate Kid, The (1984)",Drama,"국가: 미국
줄거리: 이 영화는 무술을 통해 자신감을 얻고 어려움을 극복하는 소년의 이야기를 다룬다.
분위기 및 심리변화: 희망적이고 영감을 주는 분위기 속에서, 주인공은 두려움에서 자신감을 얻으며 성장한다."
275,"Sixth Sense, The (1999)",Drama|Horror|Mystery,"국가: 미국
줄거리: 이 영화는 죽은 사람들을 볼 수 있는 소년과 그를 돕는 심리학자의 이야기를 다룬다.
분위기 및 심리변화: 신비롭고 긴장감 넘치는 분위기 속에서, 주인공들은 두려움과 불안을 극복하며 진실을 받아들이게 된다."
276,Harry Potter and the Deathly Hallows: Part 2 (2011),Action|Adventure|Drama|Fantasy|Mystery|IMAX,"국가: 영국
줄거리: 해리 포터가 볼드모트를 물리치기 위해 마지막 전투에 나서는 이야기를 그립니다.
분위기 및 심리변화: 서사적이고 감동적인 분위기 속에서, 주인공은 희생과 용기를 발휘합니다."
277,Bridge to Terabithia (2007),Adventure|Children|Fantasy,"국가: 미국
줄거리: 두 아이가 상상 속의 세계를 만들며 우정을 나누고 성장하는 이야기입니다.
분위기 및 심리변화: 감동적이고 상상력 넘치는 분위기 속에서, 주인공들은 우정과 상실을 경험합니다."
278,"Crazy, Stupid, Love. (2011)",Comedy|Drama|Romance,"국가: 미국
줄거리: 사랑과 결혼 생활에서 위기를 맞은 남자가 새로운 친구를 만나면서 자신의 삶과 관계를 다시 바라보게 됩니다.
분위기 및 심리변화: 유머와 감동이 어우러진 분위기 속에서, 주인공은 자신의 가치를 재발견하며 성숙해집니다."
279,Harry Potter and the Chamber of Secrets (2002),Adventure|Fantasy,"국가: 영국
줄거리: 해리 포터가 호그와트에서 비밀의 방과 그 속의 괴물과 맞서 싸우는 이야기를 다룹니다.
분위기 및 심리변화: 신비롭고 모험적인 분위기 속에서, 주인공은 용기와 진실을 찾습니다."
280,"Lord of the Rings: The Return of the King, The (2003)",Action|Adventure|Drama|Fantasy,"국가: 미국, 뉴질랜드
줄거리: 이 영화는 반지의 제왕 삼부작의 마지막 이야기로, 사우론의 몰락과 중간계의 평화를 위한 마지막 전투를 다룬다.
분위기 및 심리변화: 장엄하고 희망적인 분위기 속에서, 주인공들은 희생과 용기를 통해 내적 성장과 승리를 이룬다."
281,Extraction 2 (2023),Action|Thriller,"국가: 미국
줄거리: 특수부대 요원이 인질을 구출하는 과정에서 벌어지는 액션 영화입니다.
분위기 및 심리변화: 긴장감 넘치고 액션 가득한 분위기 속에서, 주인공은 용기와 희생을 다짐합니다."
282,Elemental (2023),Animation|Children|Comedy|Fantasy|Romance,"국가: 미국
줄거리: 서로 다른 성질을 가진 요소들이 공존하며 화합과 이해를 배우는 이야기를 그립니다.
분위기 및 심리변화: 따뜻하고 교훈적인 분위기 속에서, 주인공들은 차이를 극복하고 조화를 찾습니다."
283,"Bourne Supremacy, The (2004)",Action|Crime|Thriller,"국가: 미국, 독일
줄거리: 이 영화는 기억을 잃은 제이슨 본이 자신의 과거를 추적하며 국제 음모에 휘말리는 이야기를 그린다.
분위기 및 심리변화: 긴박한 분위기 속에서, 주인공은 혼란 속에서 자신의 정체성과 목적을 찾아간다."
284,Wrath of Man (2021),Action|Crime,"국가: 미국
줄거리: 아들의 죽음에 대한 복수를 꿈꾸는 남자가 보안 회사에서 벌어지는 음모와 싸우는 이야기입니다.
분위기 및 심리변화: 강렬하고 어두운 분위기 속에서, 주인공은 복수와 정의를 추구합니다."
285,What We Do in the Shadows (2014),Comedy|Horror,"국가: 뉴질랜드
줄거리: 뱀파이어들이 인간 세상에서 살아가는 이야기를 다룬 코미디 영화입니다.
분위기 및 심리변화: 유머러스하고 기이한 분위기 속에서, 주인공들은 공존과 우정을 경험합니다."
286,Bridget Jones's Diary (2001),Comedy|Drama|Romance,"국가: 영국
줄거리: 한 여성이 사랑과 직장 문제를 겪으며 일상의 소소한 기쁨과 고뇌를 일기에 적는 이야기입니다.
분위기 및 심리변화: 유쾌하고 감성적인 분위기 속에서, 주인공은 사랑과 자아를 찾습니다."
287,Bullet Train (2022),Action|Mystery|Thriller,"국가: 미국
줄거리: 여러 암살자들이 일본의 고속열차에서 목표를 수행하는 동안 얽히고설킨 이야기를 그립니다.
분위기 및 심리변화: 스릴 넘치고 유머러스한 분위기 속에서, 주인공들은 생존과 경쟁의 갈등을 겪습니다."
288,"Bourne Ultimatum, The (2007)",Action|Crime|Thriller,"국가: 미국, 독일
줄거리: 이 영화는 제이슨 본이 자신의 기억을 완전히 되찾고 진실을 밝히기 위한 마지막 여정을 다룬다.
분위기 및 심리변화: 스릴 넘치는 분위기 속에서, 주인공은 자신감을 되찾고 자신의 운명을 받아들인다."
289,The Banshees of Inisherin (2022),Comedy|Drama,"국가: 아일랜드
줄거리: 아일랜드 시골 마을에서 벌어지는 두 친구의 갈등과 우정을 다룬 이야기입니다.
분위기 및 심리변화: 잔잔하고 서정적인 분위기 속에서, 주인공은 인간 관계의 깊이를 되새깁니다."
290,Women Talking (2022),Drama,"국가: 미국
줄거리: 여성들이 자신들의 미래를 결정하기 위해 서로 이야기를 나누는 과정을 그립니다.
분위기 및 심리변화: 진지하고 감정적인 분위기 속에서, 주인공들은 용기와 연대의 의미를 탐구합니다."
291,Four Weddings and a Funeral (1994),Comedy|Romance,"국가: 영국
줄거리: 여러 결혼식과 장례식을 통해 얽히고설킨 사랑과 우정의 이야기를 다룹니다.
분위기 및 심리변화: 감성적이고 유머러스한 분위기 속에서, 주인공은 사랑과 삶의 의미를 깨닫습니다."
292,Evangelion: 2.0 You Can (Not) Advance (Evangerion shin gekijôban: Ha) (2009),Action|Animation|Drama|Sci-Fi,"국가: 일본
줄거리: 이 영화는 거대한 메카와 외계 생명체의 전투를 통해 인간의 심리와 관계를 탐구한다.
분위기 및 심리변화: 강렬하고 철학적인 분위기 속에서, 주인공들은 두려움과 불확실성을 극복하며 자신들의 정체성을 찾아간다."
293,Spider-Man: Across the Spider-Verse (2023),Action|Adventure|Animation|Sci-Fi,"국가: 미국
줄거리: 마일스 모랄레스가 다양한 스파이더맨들과 함께 다중우주에서 위협에 맞서는 이야기입니다.
분위기 및 심리변화: 스릴 넘치고 감동적인 분위기 속에서, 주인공은 책임감과 협력의 중요성을 배웁니다."
